518,DSN-5187,-37,1145,495,,,541,#NUM!,Dwarf,Red,M,1,10,-,DSN-5187 Alpha,Triple,-8,13,#NUM!,Dwarf,Red,M,1,DSN-5187 Beta,8,-13,Contact,,,,,#NUM!,Dwarf,Red,M,1,10,DSN-5187 Gamma,-82,667,0,0,0,0,2,Ice,1,0,0,0,0,10,0,Exists,#NUM!,DSN-5187 AB I,10,Gas Giant,,,Large,Massive,1,11,0,0,4,0,,,5,,,Abundant Iron Clouds,Eyeball Giant,"Atmospheric Bands, Cloud Layers, Polar Vortices","Synchronized Rotation, Meteor Streaks, Aurorae, Wind, Jetstreams, Storms, Lightning, Cyclones, Cloud Pillars, Haze, Free-Floating Clouds, Liquid-Iron Rain, Diamond Rain, Nightside Heat-Glow",1,-1,0,,,,7,1,37,-44,Exists,#NUM!,DSN-5187 AB II,7,Rocky Planet,10,,Medium,Medium,0,5,0,5,0,5,9,8,9,-,,Global Water Cloud Cover,Shrouded Planet,"Mountains, Plains, Dunes, Volcanoes","Day/Night Rotation, Ash Rain, Lava Flows, Volcanic Eruptions, Volcanic Lightning, Ash Devils, Ash Blizzards, Wind, Dust Devils, Dust Storms, Lightning, Atmospheric Water Rain, Tornadoes, Storms",3,3,2,Marginal Carbon-Water Life,in the Clouds,,14,3,-66,265,-,,,,,,,,,,,,,,,,,,,,,,,,,,,,,,,,,,Exists,#NUM!,2,Moon,DSN-5187 AB II a,Small,Light,10,2,0,0,2,2,7,6,0,-,,,Dry Moon,"Gravitational Rounding, Mountains, Plains, Dunes, Volcanoes","Synchronized Rotation, Sunrises, Sunsets, Meteor Impacts, Meteor Streaks, Aurorae, Ash Rain, Lava Flows, Volcanic Eruptions, Volcanic Lightning, Ash Devils, Ash Blizzards, Wind, Dust Devils, Dust Storms",8,Usually Not Eclipsed,,,-120,273,-,,,,,,,,,,,,,,,,,,,,,,,,,,,,,,-,,,,,,,,,,-,,,,,-,,,,
519,DSN-5197,-854,-713,496,,520,542,#NUM!,Dwarf,Red,M,1,10,-,DSN-5197,Single,0,0,,,,,,,,,,,,,,,,,,,,,,,0,0,0,0,2,Ice,1,0,0,0,0,3,0,Exists,#NUM!,DSN-5197 I,3,Rocky Planet,5,,Small,Light,0,3,1,0,0,2,3,2,2,Equatorial Water Lakes,Polar Water-Ice Glaciers,Sparse Water Clouds,Mixed Planet,"Mountains, Plains, Dunes, Water-Ice Glaciers, Polar Water-Ice Caps, Volcanoes, Water Lakes, Water Rivers, Canyons","Day/Night Rotation, Sunrises, Sunsets, Meteor Streaks, Aurorae, Ash Rain, Lava Flows, Volcanic Eruptions, Volcanic Lightning, Ash Devils, Ash Blizzards, Wind, Dust Devils, Dust Storms, Water Snow, Water Frost, Blizzards, Avalanches, Snow Devils, Ice Calving, Water-Icebergs, Hail",2,0,3,Marginal Carbon-Water Life,on the Land,,10,3,128,34,-,,,,,,,,,,,,,,,,,,,,,,,,,,,,,,,,,,Exists,#NUM!,DSN-5197 II,0,Large Asteroid,,Icy Carb.,Small,Micro,0,,,,,,,,,Surface Ice,,,Icy Asteroid,"Rocky Surface, Ice",Rotation,8,0,1,,,,2,1,-750,-350,-,,,,,,,,,,,,,,,,,,,,,,,,,,,,-,,,,,,,,,,,,,,,,,,,,,,,,,,,,,,-,,,,,,,,,,-,,,,,-,,,,
520,DSN-5209,-825,-620,497,519,,543,#NUM!,Dwarf,Red,M,1,10,-,DSN-5209 Alpha,Triple,125,149,#NUM!,Dwarf,Red,M,1,DSN-5209 Beta,-125,-149,Detached,,,,,#NUM!,Dwarf,Red,M,1,10,DSN-5209 Gamma,-538,-618,0,0,0,0,5,Ice,1,0,0,0,0,10,0,Exists,#NUM!,DSN-5209 Alpha I,5,Gas Giant,,,Medium,Massive,1,11,5,3,0,0,,,6,,,Abundant Sulfuric-Acid Clouds,Eyeball Giant,"Atmospheric Bands, Cloud Layers, Polar Vortices","Synchronized Rotation, Meteor Streaks, Aurorae, Wind, Jetstreams, Storms, Lightning, Cyclones, Cloud Pillars, Haze, Free-Floating Clouds, Sulfuric-Acid Rain, Diamond Rain, Hail, Snow",2,-1,0,Marginal Carbon-Sulfuric-Acid Life,in the Clouds,,15,2,28,225,-,,,,,,,,,,,,,,,,,,,,,,,,,,,,,,,,,,-,,,,,,,,,,,,,,,,,,,,,,,,,,,,,,,,,,-,,,,,,,,,,,,,,,,,,,,,,,,,,,,-,,,,,,,,,,,,,,,,,,,,,,,,,,,,,,-,,,,,,,,,,-,,,,,-,,,,
521,DSN-5210,-758,-482,498,,522,544,#NUM!,Dwarf,Orange,K,2,7,-,DSN-5210 Alpha,Binary,11,15,#NUM!,Dwarf,Red,M,1,DSN-5210 Beta,-11,-15,Contact,,,,,,,,,,,,,,0,0,0,0,1,No Ice,0,0,0,0,0,6,0,Exists,#NUM!,DSN-5210 AB I,7,Rocky Planet,10,,Small,Light,0,2,0,0,0,2,7,6,3,-,,Abundant Ammonia Clouds,Dry Planet,"Mountains, Plains, Dunes, Volcanoes","Day/Night Rotation, Sunrises, Sunsets, Meteor Impacts, Meteor Streaks, Aurorae, Ash Rain, Lava Flows, Volcanic Eruptions, Volcanic Lightning, Ash Devils, Ash Blizzards, Wind, Dust Devils, Dust Storms, Lightning, Atmospheric Ammonia Rain, Tornadoes, Storms",3,0,6,Marginal Carbon-Ammonia Life,in the Clouds,,2,1,-180,-55,Exists,#NUM!,DSN-5210 AB II,1,Rocky Planet,1,,Small,Light,0,2,0,0,0,0,1,0,4,Deep Global Water-Ice Shell and Subsurface Ocean,,Abundant Water Clouds,Ice-Shell Planet,"Mountains, Plains, Subsurface Water Ocean, Water Cryovolcanoes, Craters","Day/Night Rotation, Sunrises, Sunsets, Meteor Impacts, Meteor Streaks, Aurorae, Cryovolcanic Eruptions, Water-Ice Rain, Wind, Snow Devils, Blizzards, Lightning, Water Snow, Water Frost, Avalanches",6,10,0,Marginal Carbon-Water Life,in the Clouds,,13,2,57,648,Exists,#NUM!,DSN-5210 AB III,0,Rocky Planet,0,,Large,Heavy,0,0,,,,,0,0,0,Global Water-Ice Glaciers,,No Clouds,Mixed Planet,"Mountains, Plains, Water-Ice Glaciers, Craters","Day/Night Rotation, Sunrises, Sunsets, Meteor Impacts",8,4,0,Marginal Carbon-Water Life,in the Clouds,,10,2,713,429,-,,,,,,,,,,,,,,,,,,,,,,,,,,,,-,,,,,,,,,,,,,,,,,,,,,,,,,,,,,,-,,,,,,,,,,Exists,292.5,#NUM!,111,-415,-,,,,
522,DSN-5228,-723,-426,499,521,,545,#NUM!,Dwarf,Red,M,1,10,-,DSN-5228,Single,0,0,,,,,,,,,,,,,,,,,,,,,,,0,0,0,0,4,Ice,1,0,0,0,0,3,0,Exists,#NUM!,DSN-5228 I,3,Rocky Planet,1,,Small,Light,0,3,0,0,3,0,3,2,8,,Polar Ammonia Oceans,Global Ammonia Cloud Cover,Shrouded Planet,"Mountains, Plains, Dunes, Volcanoes, Craters, Ammonia Lakes, Ammonia Rivers, Canyons, Ammonia Oceans","Day/Night Rotation, Ash Rain, Wind, Dust Devils, Dust Storms, Lightning, Ammonia Rain, Fog, Tornadoes, Storms, Landslides, Sinkholes, Ammonia Dew, Hurricanes, Tsunamis, Sea Storms, Ammonia-Spouts",3,3,1,,,,7,3,167,-161,Exists,#NUM!,DSN-5228 II,0,Rocky Planet,0,,Large,Heavy,0,0,,,,,0,0,0,Deep Global Water-Ice Shell and Subsurface Ocean,,No Clouds,Ice-Shell Planet,"Mountains, Plains, Subsurface Water Ocean, Water Cryovolcanoes, Craters","Day/Night Rotation, Sunrises, Sunsets, Meteor Impacts, Cryovolcanic Eruptions, Water-Ice Rain",7,8,4,,,,2,2,-686,-263,Exists,#NUM!,DSN-5228 III,0,Rocky Planet,0,,Medium,Medium,0,0,,,,,0,0,0,Global Water-Ice Shell and Subsurface Ocean,,No Clouds,Ice-Shell Planet,"Mountains, Plains, Subsurface Water Ocean, Water Cryovolcanoes, Craters","Day/Night Rotation, Sunrises, Sunsets, Meteor Impacts, Cryovolcanic Eruptions, Water-Ice Rain",8,0,7,,,,10,2,872,352,Exists,#NUM!,2,Moon,DSN-5228 II a,Micro,Micro,3,,,,,,0,0,,Surface Ice,,,Icy Minimoon,"Rocky Surface, Ice","Synchronized Rotation, Sunrises, Sunsets",6,Usually Not Eclipsed,,,-718,-219,-,,,,,,,,,,,,,,,,,,,,,,,,,,,,,,-,,,,,,,,,,-,,,,,-,,,,
523,DSN-5237,-636,-322,500,,524,546,#NUM!,Dwarf,Red,M,1,10,-,DSN-5237 Alpha,Binary,38,-17,#NUM!,Dwarf,Red,M,1,DSN-5237 Beta,-38,17,Contact,,,,,,,,,,,,,,0,0,0,0,9,Ice,2,0,0,0,0,7,0,Exists,#NUM!,DSN-5237 AB I,6,Rocky Planet,0,,Large,Heavy,0,0,,,,,6,5,0,-,,No Clouds,Dry Planet,"Mountains, Plains, Craters","Day/Night Rotation, Sunrises, Sunsets, Meteor Impacts",3,0,0,,,,9,2,236,25,Exists,#NUM!,DSN-5237 AB II,0,Rocky Planet,0,,Medium,Medium,0,0,,,,,0,0,0,-,,No Clouds,Dry Planet,"Mountains, Plains, Craters","Day/Night Rotation, Sunrises, Sunsets, Meteor Impacts",6,4,3,,,,1,2,-563,-39,-,,,,,,,,,,,,,,,,,,,,,,,,,,,,,,,,,,-,,,,,,,,,,,,,,,,,,,,,,,,,,,,-,,,,,,,,,,,,,,,,,,,,,,,,,,,,,,-,,,,,,,,,,-,,,,,-,,,,
524,DSN-5245,-573,-230,501,523,525,547,#NUM!,Dwarf,Red,M,1,10,-,DSN-5245 Alpha,Binary,156,386,#NUM!,Dwarf,Brown,Br.,0,DSN-5245 Beta,-156,-386,Detached,,,,,,,,,,,,,,0,0,0,0,10,Ice,3,0,0,0,0,3,0,Exists,#NUM!,DSN-5245 Alpha I,3,Large Asteroid,,Carbonaceous,Medium,Micro,1,,,,,,,,,-,,,Asteroid,Rocky Surface,Rotation,2,-1,0,,,,9,3,280,401,Exists,#NUM!,DSN-5245 Beta I,2,Rocky Planet,8,,Small,Light,0,2,0,0,0,2,2,1,5,Deep Global Water-Ice Shell and Subsurface Ocean,,Abundant Water Clouds,Ice-Shell Planet,"Mountains, Plains, Subsurface Water Ocean, Water Cryovolcanoes, Craters","Day/Night Rotation, Sunrises, Sunsets, Meteor Impacts, Meteor Streaks, Aurorae, Cryovolcanic Eruptions, Water-Ice Rain, Wind, Snow Devils, Blizzards, Lightning, Water Snow, Water Frost, Avalanches",2,1,0,Marginal Carbon-Water Life,Primarily in the Clouds,,10,2,-37,-343,Exists,#NUM!,DSN-5245 Beta II,1,Gas Giant,,,Small,Massive,0,11,0,5,0,0,,,6,,,Abundant Ammonia Clouds,Ice Giant,"Atmospheric Bands, Cloud Layers, Polar Vortices, Shrouded Supercritical-Fluid Ocean","Day/Night Rotation, Sunrises, Sunsets, Meteor Streaks, Aurorae, Wind, Jetstreams, Storms, Lightning, Cyclones, Cloud Pillars, Haze, Free-Floating Clouds, Ammonia Rain, Diamond Rain, Hail, Snow",3,5,0,Marginal Carbon-Ammonia Life,in the Clouds,,2,3,-386,-519,-,,,,,,,,,,,,,,,,,,,,,,,,,,,,-,,,,,,,,,,,,,,,,,,,,,,,,,,,,,3,Exist,Icy Carb.,#NUM!,DSN-5245 Beta II Gr.,-156,-652,#NUM!,DSN-5245 Beta II Tr.,-386,-253,-,,,,,-,,,,
525,DSN-5252,-553,-203,502,524,,,#NUM!,Dwarf,Red,M,1,10,-,DSN-5252,Single,0,0,,,,,,,,,,,,,,,,,,,,,,,0,0,0,0,8,Ice,2,0,0,0,0,3,0,Exists,#NUM!,DSN-5252 I,3,Large Asteroid,,Metallic,Medium,Micro,0,,,,,,,,,-,,,Asteroid,Rocky Surface,Rotation,3,3,1,,,,13,2,-8,236,Exists,#NUM!,DSN-5252 II,1,Rocky Planet,3,,Medium,Medium,0,2,0,1,0,1,1,0,3,Global Water-Ice Shell and Subsurface Ocean,,Abundant Water Clouds,Ice-Shell Planet,"Mountains, Plains, Subsurface Water Ocean, Water Cryovolcanoes, Craters","Day/Night Rotation, Sunrises, Sunsets, Meteor Impacts, Meteor Streaks, Aurorae, Cryovolcanic Eruptions, Water-Ice Rain, Wind, Snow Devils, Blizzards, Lightning, Water Snow, Water Frost, Avalanches",5,10,0,Marginal Carbon-Water Life,in the Clouds,,12,2,140,457,Exists,#NUM!,DSN-5252 III,0,Rocky Planet,0,,Large,Heavy,0,0,,,,,0,0,0,Global Sulfuric-Acid-Ice Glaciers,,No Clouds,Mixed Planet,"Mountains, Plains, Sulfuric-Acid-Ice Glaciers, Craters","Day/Night Rotation, Sunrises, Sunsets, Meteor Impacts",8,0,1,Marginal Silicon-Sulfuric-Acid Life,in the Clouds,,2,2,-838,-322,Exists,#NUM!,2,Moon,DSN-5252 II a,Micro,Micro,8,,,,,,1,0,,Surface Ice,Polar Ammonia-Ice Glaciers,,Icy Minimoon,"Gravitational Rounding, Rocky Surface, Ice","Synchronized Rotation, Sunrises, Sunsets",8,Usually Not Eclipsed,,,187,486,-,,,,,,,,,,,,,,,,,,,,,,,,,,,,,,-,,,,,,,,,,-,,,,,-,,,,
526,DSN-5267,-641,-99,,,527,549,#NUM!,Dwarf,Red,M,1,10,-,DSN-5267,Single,0,0,,,,,,,,,,,,,,,,,,,,,,,0,0,0,0,9,Ice,2,0,0,0,0,3,0,Exists,#NUM!,DSN-5267 I,2,Gas Giant,,,Medium,Massive,0,11,7,9,0,0,,,4,,,Abundant Sulfuric-Acid Clouds,Gas Giant,"Atmospheric Bands, Cloud Layers, Polar Vortices","Day/Night Rotation, Sunrises, Sunsets, Meteor Streaks, Aurorae, Wind, Jetstreams, Storms, Lightning, Cyclones, Cloud Pillars, Haze, Free-Floating Clouds, Sulfuric-Acid Rain, Diamond Rain, Hail, Snow",4,1,6,Marginal Carbon-Sulfuric-Acid Life,in the Clouds,,11,1,205,205,Exists,#NUM!,DSN-5267 II,0,Large Asteroid,,Icy Carb.,Medium,Micro,0,,,,,,,,,Surface Ice and Subsurface Ocean,,,Icy Asteroid,"Rocky Surface, Ice",Rotation,6,6,2,,,,7,2,453,-381,-,,,,,,,,,,,,,,,,,,,,,,,,,,,,,,,,,,-,,,,,,,,,,,,,,,,,,,,,,,,,,,,-,,,,,,,,,,,,,,,,,,,,,,,,,,,,,,-,,,,,,,,,,-,,,,,-,,,,
527,DSN-5271,-626,-42,,526,528,550,#NUM!,Dwarf,Red,M,1,10,-,DSN-5271,Single,0,0,,,,,,,,,,,,,,,,,,,,,,,0,0,0,0,3,Ice,1,0,0,0,0,3,0,Exists,#NUM!,DSN-5271 I,3,Rocky Planet,0,,Small,Light,0,2,1,2,0,0,4,3,7,,Polar Water Oceans,Global Water Cloud Cover,Shrouded Planet,"Mountains, Plains, Dunes, Craters, Water Lakes, Water Rivers, Canyons, Water Oceans","Day/Night Rotation, Meteor Impacts, Wind, Dust Devils, Dust Storms, Lightning, Water Rain, Fog, Tornadoes, Storms, Landslides, Sinkholes, Water Dew, Hurricanes, Tsunamis, Sea Storms, Water-Spouts",3,6,2,Marginal Silicon-Water Life,Primarily in the Oceans/Lakes,,7,3,158,-137,Exists,#NUM!,DSN-5271 II,0,Rocky Planet,0,,Large,Heavy,0,0,,,,,0,0,0,Partial Global Water-Ice Shell,,No Clouds,Mixed Planet,"Mountains, Plains, Water-Ice Glaciers, Craters","Day/Night Rotation, Sunrises, Sunsets, Meteor Impacts, Water Snow, Water Frost, Blizzards, Avalanches, Snow Devils, Water Cryvolcanic Eruptions, Ice Rain",6,3,0,,,,15,2,-354,437,Exists,#NUM!,DSN-5271 III,0,Rocky Planet,0,,Small,Light,0,0,,,,,0,0,0,Global Water-Ice Shell and Subsurface Ocean,,No Clouds,Ice-Shell Planet,"Mountains, Plains, Subsurface Water Ocean, Water Cryovolcanoes, Craters","Day/Night Rotation, Sunrises, Sunsets, Meteor Impacts, Cryovolcanic Eruptions, Water-Ice Rain",8,3,3,,,,4,2,-202,-811,Exists,#NUM!,2,Moon,DSN-5271 II a,Micro,Micro,0,,,,,,0,0,,Surface Ice,,,Icy Minimoon,"Rocky Surface, Ice","Synchronized Rotation, Sunrises, Sunsets",6,Usually Not Eclipsed,,,-314,475,-,,,,,,,,,,,,,,,,,,,,,,,,,,,,,,-,,,,,,,,,,-,,,,,-,,,,
528,DSN-5287,-634,49,505,527,529,551,#NUM!,Dwarf,Brown,Br.,0,0,-,DSN-5287 Alpha,Binary,-578,361,#NUM!,Dwarf,Yellow,G,3,DSN-5287 Beta,578,-361,Detached,,,,,,,,,,,,,,0,0,0,0,1,No Ice,0,0,0,0,0,2,0,Exists,#NUM!,DSN-5287 Alpha I,2,Gas Giant,,,Large,Massive,0,11,1,5,0,0,,,6,,,Abundant Sulfuric-Acid Clouds,Gas Giant,"Atmospheric Bands, Cloud Layers, Polar Vortices","Day/Night Rotation, Sunrises, Sunsets, Meteor Streaks, Aurorae, Wind, Jetstreams, Storms, Lightning, Cyclones, Cloud Pillars, Haze, Free-Floating Clouds, Sulfuric-Acid Rain, Diamond Rain, Hail, Snow",2,5,5,Marginal Carbon-Sulfuric-Acid Life,in the Clouds,,11,2,-411,512,-,,,,,,,,,,,,,,,,,,,,,,,,,,,,,,,,,,-,,,,,,,,,,,,,,,,,,,,,,,,,,,,,,,,,,Exists,#NUM!,1,Moon,DSN-5287 Alpha I a,Small,Light,10,2,0,1,0,2,2,1,0,-,,,Dry Moon,"Gravitational Rounding, Mountains, Plains, Dunes, Volcanoes","Synchronized Rotation, Sunrises, Sunsets, Meteor Impacts, Meteor Streaks, Aurorae, Ash Rain, Lava Flows, Volcanic Eruptions, Volcanic Lightning, Ash Devils, Ash Blizzards, Wind, Dust Devils, Dust Storms",4,Eclipsed Each Day,,,-466,513,-,,,,,,,,,,,,,,,,,,,,,,,,,,,,,,-,,,,,,,,,,-,,,,,Exists,112.5,#NUM!,476,-8
529,DSN-5291,-553,121,506,528,530,552,#NUM!,Dwarf,Red,M,1,10,-,DSN-5291 Alpha,Triple,182,39,#NUM!,Dwarf,Orange,K,2,DSN-5291 Beta,-182,-39,Detached,,,,,#NUM!,Dwarf,Red,M,1,10,DSN-5291 Gamma,292,-599,0,0,0,0,8,No Ice,2,0,0,0,0,9,0,Exists,#NUM!,DSN-5291 Alpha I,8,Rocky Planet,10,,Small,Light,1,3,0,0,2,3,9,6,2,-,,Sparse Ammonia Clouds,Eyeball Planet,"Mountains, Plains, Dunes, Volcanoes","Synchronized Rotation, Meteor Streaks, Aurorae, Ash Rain, Lava Flows, Volcanic Eruptions, Volcanic Lightning, Ash Devils, Ash Blizzards, Wind, Dust Devils, Dust Storms",1,-1,0,,,,14,2,140,137,Exists,#NUM!,DSN-5291 Beta I,8,Gas Giant,,,Medium,Massive,1,11,0,5,0,0,,,4,,,Abundant Iron Clouds,Eyeball Giant,"Atmospheric Bands, Cloud Layers, Polar Vortices","Synchronized Rotation, Meteor Streaks, Aurorae, Wind, Jetstreams, Storms, Lightning, Cyclones, Cloud Pillars, Haze, Free-Floating Clouds, Liquid-Iron Rain, Diamond Rain, Nightside Heat-Glow",1,-1,0,,,,14,1,-235,46,Exists,#NUM!,DSN-5291 Gamma I,6,Rocky Planet,1,,Large,Heavy,1,5,1,0,0,1,7,4,0,-,,No Clouds,Eyeball Planet,"Mountains, Plains, Dunes, Volcanoes, Craters","Synchronized Rotation, Meteor Streaks, Aurorae, Ash Rain, Wind, Dust Devils, Dust Storms",1,-1,0,,,,8,2,388,-662,-,,,,,,,,,,,,,,,,,,,,,,,,,,,,-,,,,,,,,,,,,,,,,,,,,,,,,,,,,,,-,,,,,,,,,,-,,,,,-,,,,
530,DSN-5308,-533,193,507,529,,553,#NUM!,Dwarf,Red,M,1,10,-,DSN-5308 Alpha,Binary,-26,-8,#NUM!,Dwarf,Red,M,1,DSN-5308 Beta,26,8,Contact,,,,,,,,,,,,,,0,0,0,0,10,Ice,3,0,0,0,0,7,0,Exists,#NUM!,DSN-5308 AB I,4,Gas Giant,,,Large,Massive,0,11,9,7,0,0,,,9,,,Global Sulfuric-Acid Cloud Layers,Gas Giant,"Atmospheric Bands, Cloud Layers, Polar Vortices","Day/Night Rotation, Sunrises, Sunsets, Meteor Streaks, Aurorae, Wind, Jetstreams, Storms, Lightning, Cyclones, Cloud Pillars, Haze, Free-Floating Clouds, Sulfuric-Acid Rain, Diamond Rain, Hail, Snow",4,5,3,Marginal Carbon-Sulfuric-Acid Life,in the Clouds,,3,3,-277,-187,Exists,#NUM!,DSN-5308 AB II,0,Rocky Planet,0,,Large,Heavy,0,0,,,,,0,0,0,Partial Global Water-Ice Shell,,No Clouds,Mixed Planet,"Mountains, Plains, Water-Ice Glaciers, Craters","Day/Night Rotation, Sunrises, Sunsets, Meteor Impacts, Water Snow, Water Frost, Blizzards, Avalanches, Snow Devils, Water Cryvolcanic Eruptions, Ice Rain",6,4,1,,,,7,2,467,-435,Exists,#NUM!,DSN-5308 AB III,0,Rocky Planet,0,,Small,Light,0,0,,,,,0,0,0,Global Water-Ice Glaciers,,No Clouds,Mixed Planet,"Mountains, Plains, Water-Ice Glaciers, Craters","Day/Night Rotation, Sunrises, Sunsets, Meteor Impacts",8,4,2,Marginal Carbon-Water Life,in the Clouds,,13,3,98,934,Exists,#NUM!,2,Moon,DSN-5308 AB II a,Micro,Micro,8,,,,,,0,0,,Surface Ice,,,Icy Minimoon,"Gravitational Rounding, Rocky Surface, Ice","Synchronized Rotation, Sunrises, Sunsets",6,Usually Not Eclipsed,,,427,-397,-,,,,,,,,,,,,,,,,,,,,,,,,,,,,,,-,,,,,,,,,,Exists,67.5,#NUM!,97,241,-,,,,
531,DSN-5317,-494,322,508,,532,554,#NUM!,Dwarf,Red,M,1,10,-,DSN-5317 Alpha,Binary,-622,-110,#NUM!,Dwarf,Red,M,1,DSN-5317 Beta,622,110,Detached,,,,,,,,,,,,,,0,0,0,0,6,Ice,2,0,0,0,0,7,0,Exists,#NUM!,DSN-5317 Alpha I,2,Rocky Planet,1,,Large,Heavy,0,8,0,2,0,1,3,2,1,Global Water-Ice Glaciers,,Sparse Water Clouds,Mixed Planet,"Mountains, Plains, Dunes, Water-Ice Glaciers, Volcanoes","Day/Night Rotation, Sunrises, Sunsets, Meteor Streaks, Aurorae, Ash Rain, Wind, Dust Devils, Dust Storms",3,1,2,,,,9,3,-340,-100,Exists,#NUM!,DSN-5317 Beta I,3,Rocky Planet,9,,Large,Heavy,0,6,0,2,0,5,4,3,2,Partial Equatorial Water Oceans,Partial Polar Water-Ice Shell,Sparse Water Clouds,Mixed Planet,"Mountains, Plains, Dunes, Water-Ice Glaciers, Polar Water-Ice Caps, Volcanoes, Water Lakes, Water Rivers, Canyons, Water Oceans","Day/Night Rotation, Sunrises, Sunsets, Meteor Streaks, Aurorae, Ash Rain, Lava Flows, Volcanic Eruptions, Volcanic Lightning, Ash Devils, Ash Blizzards, Wind, Dust Devils, Dust Storms, Water Snow, Water Frost, Blizzards, Avalanches, Snow Devils, Ice Calving, Water-Icebergs, Hail",2,0,6,Superabundant Silicon-Water Life,Primarily on the Land,Green,4,3,571,-29,Exists,#NUM!,DSN-5317 Beta II,2,Rocky Planet,5,,Medium,Medium,0,2,0,0,0,1,2,1,1,-,,Sparse Water Clouds,Dry Planet,"Mountains, Plains, Dunes, Volcanoes","Day/Night Rotation, Sunrises, Sunsets, Meteor Impacts, Meteor Streaks, Aurorae, Ash Rain, Lava Flows, Volcanic Eruptions, Volcanic Lightning, Ash Devils, Ash Blizzards, Wind, Dust Devils, Dust Storms",3,8,1,,,,6,1,768,-165,Exists,#NUM!,1,Moon,DSN-5317 Alpha I a,Micro,Micro,0,,,,,,2,1,,Surface Ice,,,Icy Minimoon,"Rocky Surface, Ice","Synchronized Rotation, Sunrises, Sunsets",6,Usually Not Eclipsed,,,-390,-123,-,,,,,,,,,,,,,,,,,,,,,,,,,,,,,,-,,,,,,,,,,-,,,,,-,,,,
532,DSN-5325,-427,405,509,531,533,555,#NUM!,Dwarf,Red,M,1,10,-,DSN-5325 Alpha,Binary,80,-376,#NUM!,Giant,Blue-Violet,O,9,DSN-5325 Beta,-40,188,Detached,,,,,,,,,,,,,,0,0,0,0,10,No Ice,3,0,0,0,0,5,0,Exists,#NUM!,DSN-5325 Alpha I,10,Large Asteroid,,Silicate,Large,Micro,0,,,,,,,,,-,,,Asteroid,"Gravitational Rounding, Rocky Surface",Rotation,1,4,0,,,,13,2,69,-246,-,,,,,,,,,,,,,,,,,,,,,,,,,,,,,,,,,,-,,,,,,,,,,,,,,,,,,,,,,,,,,,,,,,,,,-,,,,,,,,,,,,,,,,,,,,,,,,,,,,-,,,,,,,,,,,,,,,,,,,,,,,,,,,,,,-,,,,,,,,,,Exists,270,#NUM!,-442,-345,Exists,337.5,#NUM!,100,-226
533,DSN-5331,-407,472,510,532,534,556,#NUM!,Dwarf,Red,M,1,10,-,DSN-5331 Alpha,Binary,298,669,#NUM!,Dwarf,Red,M,1,DSN-5331 Beta,-298,-669,Detached,,,,,,,,,,,,,,0,0,0,0,5,Ice,1,0,0,0,0,7,0,Exists,#NUM!,DSN-5331 Alpha I,2,Rocky Planet,2,,Large,Heavy,0,7,5,3,0,1,3,2,2,Partial Global Water-Ice Shell,,Sparse Water Clouds,Mixed Planet,"Mountains, Plains, Dunes, Water-Ice Glaciers, Volcanoes","Day/Night Rotation, Sunrises, Sunsets, Meteor Streaks, Aurorae, Ash Rain, Lava Flows, Volcanic Eruptions, Volcanic Lightning, Ash Devils, Ash Blizzards, Wind, Dust Devils, Dust Storms, Water Snow, Water Frost, Blizzards, Avalanches, Snow Devils",3,4,2,,,,6,3,475,374,Exists,#NUM!,DSN-5331 Beta I,3,Large Asteroid,,Carbonaceous,Medium,Micro,0,,,,,,,,,-,,,Asteroid,Rocky Surface,Rotation,2,6,6,,,,8,1,-166,-702,-,,,,,,,,,,,,,,,,,,,,,,,,,,,,,,,,,,-,,,,,,,,,,,,,,,,,,,,,,,,,,,,-,,,,,,,,,,,,,,,,,,,,,,,,,,,,,,-,,,,,,,,,,-,,,,,-,,,,
534,DSN-5341,-299,481,511,533,535,557,#NUM!,Dwarf,Brown,Br.,0,0,-,DSN-5341 Alpha,Triple,-54,127,#NUM!,Giant,Blue,B,7,DSN-5341 Beta,27,-64,Detached,,,,,#NUM!,Dwarf,Red,M,1,10,DSN-5341 Gamma,366,822,0,0,0,0,10,No Ice,3,0,0,0,0,5,0,Exists,#NUM!,DSN-5341 AB I,10,Gas Giant,,,Small,Massive,0,11,10,10,0,0,,,4,,,Abundant Iron Clouds,Hot Giant,"Atmospheric Bands, Cloud Layers, Polar Vortices","Day/Night Rotation, Sunrises, Sunsets, Meteor Streaks, Aurorae, Wind, Jetstreams, Storms, Lightning, Cyclones, Cloud Pillars, Haze, Free-Floating Clouds, Liquid-Iron Rain, Diamond Rain, Nightside Heat-Glow",4,0,3,,,,5,3,39,-321,Exists,#NUM!,DSN-5341 AB II,9,Rocky Planet,10,,Medium,Medium,0,7,0,5,0,7,11,10,3,Equatorial Lava Ocean,Polar Volcanic Crust,Abundant Ash Clouds,Lava Planet,"Lava Ocean, Islands, Polar Crust Caps","Day/Night Rotation, Sunrises, Sunsets, Meteor Streaks, Aurorae, Ash Rain, Volcanic Lightning, Ash Devils, Wind Storms, Ash Blizzards, Lava Tsunamis, Crust Calving",5,8,7,,,,12,3,122,488,Exists,#NUM!,DSN-5341 Gamma I,8,Large Asteroid,,Carbonaceous,Large,Micro,0,,,,,,,,,-,,,Asteroid,"Gravitational Rounding, Rocky Surface",Rotation,2,10,1,,,,2,1,209,789,-,,,,,,,,,,,,,,,,,,,,,,,,,,,,-,,,,,,,,,,,,,,,,,,,,,,,,,,,,,,-,,,,,,,,,,Exists,202.5,#NUM!,-584,-394,Exists,202.5,#NUM!,-245,-228
535,DSN-5355,-280,500,,534,536,,#NUM!,Dwarf,Red,M,1,10,-,DSN-5355,Single,0,0,,,,,,,,,,,,,,,,,,,,,,,0,0,0,0,3,Ice,1,0,0,0,0,3,0,-,,,,,,,,,,,,,,,,,,,,,,,,,,,,,,,,,,Exists,#NUM!,DSN-5355 I,1,Gas Giant,,,Small,Massive,0,11,2,1,0,0,,,3,,,Abundant Ammonia Clouds,Ice Giant,"Atmospheric Bands, Cloud Layers, Polar Vortices, Shrouded Supercritical-Fluid Ocean","Day/Night Rotation, Sunrises, Sunsets, Meteor Streaks, Aurorae, Wind, Jetstreams, Storms, Lightning, Cyclones, Cloud Pillars, Haze, Free-Floating Clouds, Ammonia Rain, Diamond Rain, Hail, Snow",5,6,1,Marginal Carbon-Ammonia Life,in the Clouds,,10,3,413,248,Exists,#NUM!,DSN-5355 II,0,Rocky Planet,0,,Small,Light,0,0,,,,,0,0,0,Global Water-Ice Shell and Subsurface Ocean,,No Clouds,Ice-Shell Planet,"Mountains, Plains, Subsurface Water Ocean, Water Cryovolcanoes, Craters","Day/Night Rotation, Sunrises, Sunsets, Meteor Impacts, Cryovolcanic Eruptions, Water-Ice Rain",7,0,2,,,,12,1,333,576,-,,,,,,,,,,,,,,,,,,,,,,,,,,,,-,,,,,,,,,,,,,,,,,,,,,,,,,,,,,,-,,,,,,,,,,Exists,315,#NUM!,216,-297,-,,,,
536,DSN-5361,-254,571,513,535,537,559,#NUM!,Dwarf,Yellow,G,3,5,-,DSN-5361,Single,0,0,,,,,,,,,,,,,,,,,,,,,,,0,0,0,0,10,No Ice,3,0,0,0,0,2,0,Exists,#NUM!,DSN-5361 I,5,Gas Giant,,,Medium,Massive,0,11,5,7,0,0,,,8,,,Global Sulfuric-Acid Cloud Layers,Gas Giant,"Atmospheric Bands, Cloud Layers, Polar Vortices","Day/Night Rotation, Sunrises, Sunsets, Meteor Streaks, Aurorae, Wind, Jetstreams, Storms, Lightning, Cyclones, Cloud Pillars, Haze, Free-Floating Clouds, Sulfuric-Acid Rain, Diamond Rain, Hail, Snow",2,8,0,Marginal Carbon-Sulfuric-Acid Life,in the Clouds,,8,3,153,-92,Exists,#NUM!,DSN-5361 II,2,Gas Giant,,,Medium,Massive,0,11,0,4,0,0,,,2,,,Sparse Sulfuric-Acid Clouds,Gas Giant,"Atmospheric Bands, Cloud Layers, Polar Vortices","Day/Night Rotation, Sunrises, Sunsets, Meteor Streaks, Aurorae, Wind, Jetstreams, Storms, Lightning, Cyclones, Cloud Pillars, Haze, Free-Floating Clouds, Sulfuric-Acid Rain, Diamond Rain, Hail, Snow",6,10,8,,,,11,2,501,350,Exists,#NUM!,DSN-5361 III,0,Rocky Planet,0,,Small,Light,0,0,,,,,0,0,0,Partial Global Ammonia-Ice Shell,,No Clouds,Mixed Planet,"Mountains, Plains, Ammonia-Ice Glaciers, Craters","Day/Night Rotation, Sunrises, Sunsets, Meteor Impacts",9,6,3,,,,15,2,-783,705,-,,,,,,,,,,,,,,,,,,,,,,,,,,,,Exists,#NUM!,2,Moon,Moon,DSN-5361 II a,Small,Light,10,3,2,0,3,3,2,1,0,-,,,Dry Moon,"Gravitational Rounding, Mountains, Plains, Dunes, Volcanoes","Synchronized Rotation, Sunrises, Sunsets, Meteor Streaks, Aurorae, Ash Rain, Lava Flows, Volcanic Eruptions, Volcanic Lightning, Ash Devils, Ash Blizzards, Wind, Dust Devils, Dust Storms",10,Usually Not Eclipsed,,,420,311,2,Exist,Icy Carb.,#NUM!,DSN-5361 II Gr.,-53,608,#NUM!,DSN-5361 II Tr.,554,-259,-,,,,,-,,,,
537,DSN-5378,-217,695,514,536,538,560,#NUM!,Dwarf,Red,M,1,10,-,DSN-5378 Alpha,Binary,-946,421,#NUM!,Dwarf,Red,M,1,DSN-5378 Beta,946,-421,Detached,,,,,,,,,,,,,,0,0,0,0,1,Ice,0,0,0,0,0,7,0,Exists,#NUM!,DSN-5378 Alpha I,2,Rocky Planet,2,,Medium,Medium,0,1,0,1,0,0,2,1,1,Partial Global Water-Ice Shell,,Sparse Water Clouds,Mixed Planet,"Mountains, Plains, Dunes, Water-Ice Glaciers, Volcanoes, Craters","Day/Night Rotation, Sunrises, Sunsets, Meteor Impacts, Meteor Streaks, Aurorae, Ash Rain, Lava Flows, Volcanic Eruptions, Volcanic Lightning, Ash Devils, Ash Blizzards, Wind, Dust Devils, Dust Storms, Water Snow, Water Frost, Blizzards, Avalanches, Snow Devils, Water Cryvolcanic Eruptions, Ice Rain",3,8,0,,,,5,1,-966,133,-,,,,,,,,,,,,,,,,,,,,,,,,,,,,,,,,,,Exists,#NUM!,DSN-5378 Beta I,1,Gas Giant,,,Large,Massive,0,11,0,5,0,0,,,4,,,Abundant Ammonia Clouds,Ice Giant,"Atmospheric Bands, Cloud Layers, Polar Vortices, Shrouded Supercritical-Fluid Ocean","Day/Night Rotation, Sunrises, Sunsets, Meteor Streaks, Aurorae, Wind, Jetstreams, Storms, Lightning, Cyclones, Cloud Pillars, Haze, Free-Floating Clouds, Ammonia Rain, Diamond Rain, Hail, Snow",4,8,5,Marginal Carbon-Ammonia Life,in the Clouds,,4,3,760,-882,Exists,#NUM!,1,Moon,DSN-5378 Alpha I a,Micro,Micro,4,,,,,,2,1,,Surface Ice,,,Icy Minimoon,"Gravitational Rounding, Rocky Surface, Ice","Synchronized Rotation, Sunrises, Sunsets",8,Usually Not Eclipsed,,,-953,186,Exists,#NUM!,3,Ice Ring,Ice Ring,DSN-5378 Beta I a,,,,,,,,,,,,,,,Icy Ring,"Rocks, Boulders, Dust, Ice Chunks, Ice Dust, Gaps, Ringlets, Spiral Waves, Clusters, Clumps, Shepherd Moons, Gap Moonlets, Propeller Moonlets",,8,Eclipsed Each Day,,,841,-843,3,Exist,Ice,#NUM!,DSN-5378 Beta I Gr.,1252,-813,#NUM!,DSN-5378 Beta I Tr.,454,-490,-,,,,,-,,,,
