403,DSN-4036,398,1027,,402,,426,#NUM!,Dwarf,Red,M,1,10,-,DSN-4036,Single,0,0,,,,,,,,,,,,,,,,,,,,,,,0,0,0,0,5,Ice,1,0,0,0,0,3,0,-,,,,,,,,,,,,,,,,,,,,,,,,,,,,,,,,,,Exists,#NUM!,DSN-4036 I,0,Rocky Planet,0,,Large,Heavy,0,0,,,,,0,0,0,Deep Global Ammonia-Ice Shell and Subsurface Ocean,,No Clouds,Ice-Shell Planet,"Mountains, Plains, Subsurface Ammonia Ocean, Ammonia Cryovolcanoes, Craters","Day/Night Rotation, Sunrises, Sunsets, Meteor Impacts, Cryovolcanic Eruptions, Ammonia-Ice Rain",6,8,8,,,,15,2,-424,488,-,,,,,,,,,,,,,,,,,,,,,,,,,,,,,,,,,,-,,,,,,,,,,,,,,,,,,,,,,,,,,,,-,,,,,,,,,,,,,,,,,,,,,,,,,,,,,,-,,,,,,,,,,-,,,,,-,,,,
404,DSN-4045,-508,-975,381,,405,427,#NUM!,Dwarf,Red,M,1,10,-,DSN-4045 Alpha,Binary,-203,815,#NUM!,Dwarf,Red,M,1,DSN-4045 Beta,203,-815,Detached,,,,,,,,,,,,,,0,0,0,0,0,Ice,0,0,0,0,0,7,0,Exists,#NUM!,DSN-4045 Alpha I,1,Rocky Planet,8,,Large,Heavy,0,7,7,4,0,6,2,1,3,Global Ammonia-Ice Shell and Subsurface Ocean,,Abundant Ammonia Clouds,Ice-Shell Planet,"Mountains, Plains, Subsurface Ammonia Ocean, Ammonia Cryovolcanoes","Day/Night Rotation, Sunrises, Sunsets, Meteor Streaks, Aurorae, Cryovolcanic Eruptions, Ammonia-Ice Rain, Wind, Snow Devils, Blizzards, Lightning, Ammonia Snow, Ammonia Frost, Avalanches",4,4,0,Sparse Carbon-Ammonia Life,Primarily in the Subsurface Ocean,Green,12,2,4,1189,Exists,#NUM!,DSN-4045 Beta I,3,Gas Giant,,,Small,Massive,0,11,0,10,0,0,,,6,,,Abundant Sulfuric-Acid Clouds,Gas Giant,"Atmospheric Bands, Cloud Layers, Polar Vortices","Day/Night Rotation, Sunrises, Sunsets, Meteor Streaks, Aurorae, Wind, Jetstreams, Storms, Lightning, Cyclones, Cloud Pillars, Haze, Free-Floating Clouds, Sulfuric-Acid Rain, Diamond Rain, Hail, Snow",2,1,0,Marginal Carbon-Sulfuric-Acid Life,in the Clouds,,5,1,200,-990,-,,,,,,,,,,,,,,,,,,,,,,,,,,,,,,,,,,-,,,,,,,,,,,,,,,,,,,,,,,,,,,,-,,,,,,,,,,,,,,,,,,,,,,,,,,,,,,-,,,,,,,,,,-,,,,,-,,,,
405,DSN-4055,-474,-916,382,404,,428,#NUM!,Dwarf,Red,M,1,10,-,DSN-4055 Alpha,Binary,64,257,#NUM!,Dwarf,Red,M,1,DSN-4055 Beta,-64,-257,Detached,,,,,,,,,,,,,,0,0,0,0,0,Ice,0,0,0,0,0,7,0,-,,,,,,,,,,,,,,,,,,,,,,,,,,,,,,,,,,-,,,,,,,,,,,,,,,,,,,,,,,,,,,,,,,,,,Exists,#NUM!,DSN-4055 AB I,0,Rocky Planet,0,,Large,Heavy,0,0,,,,,0,0,0,Global Water-Ice Shell,,No Clouds,Ice-Shell Planet,"Mountains, Plains, Craters","Day/Night Rotation, Sunrises, Sunsets, Meteor Impacts",6,3,9,,,,12,2,409,708,-,,,,,,,,,,,,,,,,,,,,,,,,,,,,-,,,,,,,,,,,,,,,,,,,,,,,,,,,,,,-,,,,,,,,,,-,,,,,-,,,,
406,DSN-4060,-417,-787,383,,407,,#NUM!,Dwarf,Blue-White,A,5,5,-,DSN-4060,Single,0,0,,,,,,,,,,,,,,,,,,,,,,,0,0,0,0,2,No Ice,1,0,0,0,0,2,0,-,,,,,,,,,,,,,,,,,,,,,,,,,,,,,,,,,,-,,,,,,,,,,,,,,,,,,,,,,,,,,,,,,,,,,-,,,,,,,,,,,,,,,,,,,,,,,,,,,,,,,,,,-,,,,,,,,,,,,,,,,,,,,,,,,,,,,-,,,,,,,,,,,,,,,,,,,,,,,,,,,,,,-,,,,,,,,,,Exists,0,#NUM!,821,115,Exists,67.5,#NUM!,349,629
407,DSN-4078,-382,-703,,406,408,430,#NUM!,Dwarf,Red,M,1,10,-,DSN-4078,Single,0,0,,,,,,,,,,,,,,,,,,,,,,,0,0,0,0,2,Ice,1,0,0,0,0,3,0,Exists,#NUM!,DSN-4078 I,3,Rocky Planet,5,,Small,Light,1,3,0,3,0,2,5,2,0,-,,No Clouds,Eyeball Planet,"Mountains, Plains, Dunes, Volcanoes","Synchronized Rotation, Meteor Streaks, Aurorae, Ash Rain, Lava Flows, Volcanic Eruptions, Volcanic Lightning, Ash Devils, Ash Blizzards, Wind, Dust Devils, Dust Storms",2,-1,0,,,,8,3,99,-59,-,,,,,,,,,,,,,,,,,,,,,,,,,,,,,,,,,,-,,,,,,,,,,,,,,,,,,,,,,,,,,,,,,,,,,-,,,,,,,,,,,,,,,,,,,,,,,,,,,,-,,,,,,,,,,,,,,,,,,,,,,,,,,,,,,-,,,,,,,,,,-,,,,,-,,,,
408,DSN-4080,-353,-637,385,407,409,,#NUM!,Dwarf,Red,M,1,10,-,DSN-4080,Single,0,0,,,,,,,,,,,,,,,,,,,,,,,0,0,0,0,6,Ice,2,0,0,0,0,3,0,Exists,#NUM!,DSN-4080 I,3,Rocky Planet,2,,Large,Heavy,1,3,2,2,0,1,5,2,1,-,,Sparse Water Clouds,Eyeball Planet,"Mountains, Plains, Dunes, Volcanoes, Craters","Synchronized Rotation, Meteor Streaks, Aurorae, Ash Rain, Lava Flows, Volcanic Eruptions, Volcanic Lightning, Ash Devils, Ash Blizzards, Wind, Dust Devils, Dust Storms",2,-1,0,Sparse Carbon-Water Life,Primarily in the Oceans/Lakes,Red,10,2,99,62,Exists,#NUM!,DSN-4080 II,0,Rocky Planet,0,,Medium,Medium,0,0,,,,,0,0,0,Partial Global Water-Ice Shell,,No Clouds,Mixed Planet,"Mountains, Plains, Water-Ice Glaciers, Craters","Day/Night Rotation, Sunrises, Sunsets, Meteor Impacts, Water Snow, Water Frost, Blizzards, Avalanches, Snow Devils, Water Cryvolcanic Eruptions, Ice Rain",6,0,1,,,,6,1,127,-550,Exists,#NUM!,DSN-4080 III,0,Rocky Planet,0,,Large,Heavy,0,0,,,,,0,0,0,Global Ammonia-Ice Shell and Subsurface Ocean,,No Clouds,Ice-Shell Planet,"Mountains, Plains, Subsurface Ammonia Ocean, Ammonia Cryovolcanoes, Craters","Day/Night Rotation, Sunrises, Sunsets, Meteor Impacts, Cryovolcanic Eruptions, Ammonia-Ice Rain",8,0,7,,,,8,1,794,-422,Exists,#NUM!,2,Moon,DSN-4080 II a,Micro,Micro,1,,,,,,0,0,,Surface Ice,,,Icy Minimoon,"Gravitational Rounding, Rocky Surface, Ice","Synchronized Rotation, Sunrises, Sunsets",8,Usually Not Eclipsed,,,74,-535,-,,,,,,,,,,,,,,,,,,,,,,,,,,,,,,-,,,,,,,,,,Exists,135,#NUM!,-157,168,-,,,,
409,DSN-4093,-311,-525,,408,,432,#NUM!,Dwarf,Blue-White,A,5,5,-,DSN-4093 Alpha,Binary,-184,-60,#NUM!,Dwarf,Red,M,1,DSN-4093 Beta,184,60,Detached,,,,,,,,,,,,,,0,0,0,0,9,No Ice,2,0,0,0,0,5,0,Exists,#NUM!,DSN-4093 Alpha I,9,Large Asteroid,,Metallic,Large,Micro,1,,,,,,,,,-,,,Asteroid,"Gravitational Rounding, Rocky Surface",Rotation,1,-1,0,,,,14,1,-213,43,Exists,#NUM!,DSN-4093 Beta I,10,Rocky Planet,10,,Large,Heavy,1,6,3,0,0,6,11,8,3,Partial Dayside Lava Oceans,Partial Nightside Volcanic Crust,Abundant Ash Clouds,Eyeball Planet,"Volcanoes, Mountains, Plains, Lava Oceans, Islands, Nightside Crust Cap, Dunes","Synchronized Rotation, Meteor Streaks, Aurorae, Volcanic Eruptions, Ash Rain, Volcanic Lightning, Ash Devils, Wind Storms, Ash Blizzards, Lava Tsunamis, Crust Calving",1,-1,0,,,,14,2,132,154,Exists,#NUM!,DSN-4093 AB I,4,Gas Giant,,,Small,Massive,0,11,3,0,0,0,,,10,,,Global Sulfuric-Acid Cloud Layers,Gas Giant,"Atmospheric Bands, Cloud Layers, Polar Vortices","Day/Night Rotation, Sunrises, Sunsets, Meteor Streaks, Aurorae, Wind, Jetstreams, Storms, Lightning, Cyclones, Cloud Pillars, Haze, Free-Floating Clouds, Sulfuric-Acid Rain, Diamond Rain, Hail, Snow",5,2,1,,,,3,2,-500,-435,-,,,,,,,,,,,,,,,,,,,,,,,,,,,,Exists,#NUM!,3,Moon,Moon,DSN-4093 AB I a,Micro,Micro,10,,,,,,4,3,,-,,,Minimoon,Rocky Surface,"Synchronized Rotation, Sunrises, Sunsets",10,Usually Not Eclipsed,,,-454,-358,3,Exist,Icy Met.,#NUM!,DSN-4093 AB I Gr.,127,-651,#NUM!,DSN-4093 AB I Tr.,-627,216,Exists,22.5,#NUM!,267,119,Exists,112.5,#NUM!,-242,217
410,DSN-4109,-299,-382,387,,411,433,#NUM!,Dwarf,Yellow,G,3,5,-,DSN-4109 Alpha,Binary,-39,97,#NUM!,Dwarf,Red,M,1,DSN-4109 Beta,39,-97,Detached,,,,,,,,,,,,,,0,0,0,0,3,No Ice,1,0,0,0,0,5,0,Exists,#NUM!,DSN-4109 AB I,8,Gas Giant,,,Medium,Massive,0,11,11,8,0,0,,,3,,,Abundant Iron Clouds,Hot Giant,"Atmospheric Bands, Cloud Layers, Polar Vortices","Day/Night Rotation, Sunrises, Sunsets, Meteor Streaks, Aurorae, Wind, Jetstreams, Storms, Lightning, Cyclones, Cloud Pillars, Haze, Free-Floating Clouds, Liquid-Iron Rain, Diamond Rain, Nightside Heat-Glow",3,10,7,,,,7,2,121,-149,Exists,#NUM!,DSN-4109 AB II,2,Rocky Planet,7,,Medium,Medium,0,5,0,4,0,4,3,2,8,Deep Equatorial Ammonia Ocean,Deep Polar Ammonia-Ice Shell,Global Ammonia Cloud Cover,Shrouded Planet,"Ammonia Ocean, Polar Ammonia-Ice Caps","Day/Night Rotation, Wind, Ammonia Rain, Fog, Ammonia-Spouts, Lightning, Sea Storms, Hurricanes, Tsunamis, Ammonia Snow, Ammonia Frost, Ammonia Hail, Ice Calving, Ammonia-Icebergs, Blizzards, Snow Devils",7,10,3,Sparse Silicon-Ammonia Life,Primarily in the Subsurface Ocean,Black,1,1,-657,-69,Exists,#NUM!,DSN-4109 AB III,1,Gas Giant,,,Small,Massive,0,11,8,6,0,0,,,4,,,Abundant Ammonia Clouds,Ice Giant,"Atmospheric Bands, Cloud Layers, Polar Vortices, Shrouded Supercritical-Fluid Ocean","Day/Night Rotation, Sunrises, Sunsets, Meteor Streaks, Aurorae, Wind, Jetstreams, Storms, Lightning, Cyclones, Cloud Pillars, Haze, Free-Floating Clouds, Ammonia Rain, Diamond Rain, Hail, Snow",7,0,2,,,,11,1,565,527,-,,,,,,,,,,,,,,,,,,,,,,,,,,,,-,,,,,,,,,,,,,,,,,,,,,,,,,,,,,,-,,,,,,,,,,-,,,,,-,,,,
411,DSN-4116,-249,-319,388,410,,434,#NUM!,Dwarf,Red,M,1,10,-,DSN-4116 Alpha,Triple,240,-64,#NUM!,Dwarf,Red,M,1,DSN-4116 Beta,-240,64,Detached,,,,,#NUM!,Dwarf,Red,M,1,10,DSN-4116 Gamma,526,564,0,0,0,0,0,Ice,0,0,0,0,0,10,0,Exists,#NUM!,DSN-4116 Alpha I,5,Gas Giant,,,Small,Massive,0,11,9,0,0,0,,,7,,,Global Sulfuric-Acid Cloud Layers,Gas Giant,"Atmospheric Bands, Cloud Layers, Polar Vortices","Day/Night Rotation, Sunrises, Sunsets, Meteor Streaks, Aurorae, Wind, Jetstreams, Storms, Lightning, Cyclones, Cloud Pillars, Haze, Free-Floating Clouds, Sulfuric-Acid Rain, Diamond Rain, Hail, Snow",2,2,0,,,,14,2,161,79,-,,,,,,,,,,,,,,,,,,,,,,,,,,,,,,,,,,-,,,,,,,,,,,,,,,,,,,,,,,,,,,,,,,,,,-,,,,,,,,,,,,,,,,,,,,,,,,,,,,-,,,,,,,,,,,,,,,,,,,,,,,,,,,,,,-,,,,,,,,,,-,,,,,-,,,,
412,DSN-4126,-185,-184,389,,413,435,#NUM!,Dwarf,Red,M,1,10,-,DSN-4126 Alpha,Binary,-48,27,#NUM!,Dwarf,Yellow,G,3,DSN-4126 Beta,48,-27,Contact,,,,,,,,,,,,,,0,0,0,0,2,No Ice,1,0,0,0,0,5,0,Exists,#NUM!,DSN-4126 AB I,6,Rocky Planet,2,,Large,Heavy,0,8,5,2,0,2,7,6,10,Global Water Ocean,,Global Water Cloud Cover,Shrouded Planet,"Water Ocean, Islands","Day/Night Rotation, Wind, Water Rain, Fog, Water-Spouts, Lightning, Sea Storms, Hurricanes, Tsunamis, Landslides, Sinkholes, Water Dew",4,6,4,Sparse Silicon-Water Life,Primarily in the Oceans/Lakes,Black,12,3,80,320,Exists,#NUM!,DSN-4126 AB II,4,Rocky Planet,10,,Medium,Medium,0,4,4,3,0,4,5,4,0,-,,No Clouds,Dry Planet,"Mountains, Plains, Dunes, Volcanoes","Day/Night Rotation, Sunrises, Sunsets, Meteor Streaks, Aurorae, Ash Rain, Lava Flows, Volcanic Eruptions, Volcanic Lightning, Ash Devils, Ash Blizzards, Wind, Dust Devils, Dust Storms",5,2,1,,,,1,1,-465,16,-,,,,,,,,,,,,,,,,,,,,,,,,,,,,,,,,,,-,,,,,,,,,,,,,,,,,,,,,,,,,,,,-,,,,,,,,,,,,,,,,,,,,,,,,,,,,,,-,,,,,,,,,,-,,,,,Exists,157.5,#NUM!,-449,112
413,DSN-4133,-173,-129,,412,414,436,#NUM!,Dwarf,Red,M,1,10,-,DSN-4133,Single,0,0,,,,,,,,,,,,,,,,,,,,,,,0,0,0,0,4,Ice,1,0,0,0,0,3,0,-,,,,,,,,,,,,,,,,,,,,,,,,,,,,,,,,,,Exists,#NUM!,DSN-4133 I,3,Gas Giant,,,Medium,Massive,0,11,0,7,0,0,,,8,,,Global Sulfuric-Acid Cloud Layers,Gas Giant,"Atmospheric Bands, Cloud Layers, Polar Vortices","Day/Night Rotation, Sunrises, Sunsets, Meteor Streaks, Aurorae, Wind, Jetstreams, Storms, Lightning, Cyclones, Cloud Pillars, Haze, Free-Floating Clouds, Sulfuric-Acid Rain, Diamond Rain, Hail, Snow",4,4,4,Marginal Carbon-Sulfuric-Acid Life,in the Clouds,,5,2,13,-385,Exists,#NUM!,DSN-4133 II,0,Rocky Planet,0,,Medium,Medium,0,0,,,,,0,0,0,Partial Global Water-Ice Shell,,No Clouds,Mixed Planet,"Mountains, Plains, Water-Ice Glaciers, Craters","Day/Night Rotation, Sunrises, Sunsets, Meteor Impacts",7,2,2,,,,5,1,66,-757,-,,,,,,,,,,,,,,,,,,,,,,,,,,,,-,,,,,,,,,,,,,,,,,,,,,,,,,,,,,2,Exist,Icy Carb.,#NUM!,DSN-4133 I Gr.,339,-181,#NUM!,DSN-4133 I Tr.,-327,-204,Exists,0,#NUM!,150,-13,-,,,,
414,DSN-4141,-92,-56,391,413,415,,#NUM!,Giant,Blue,B,7,5,-,DSN-4141,Single,0,0,,,,,,,,,,,,,,,,,,,,,,,0,0,0,0,6,No Ice,2,0,0,0,0,2,0,Exists,#NUM!,DSN-4141 I,8,Gas Giant,,,Medium,Massive,0,11,4,0,0,0,,,5,,,Abundant Iron Clouds,Hot Giant,"Atmospheric Bands, Cloud Layers, Polar Vortices","Day/Night Rotation, Sunrises, Sunsets, Meteor Streaks, Aurorae, Wind, Jetstreams, Storms, Lightning, Cyclones, Cloud Pillars, Haze, Free-Floating Clouds, Liquid-Iron Rain, Diamond Rain, Nightside Heat-Glow",3,5,1,,,,4,1,-85,-261,-,,,,,,,,,,,,,,,,,,,,,,,,,,,,,,,,,,Exists,#NUM!,DSN-4141 II,3,Gas Giant,,,Small,Massive,0,11,0,0,0,0,,,3,,,Abundant Sulfuric-Acid Clouds,Gas Giant,"Atmospheric Bands, Cloud Layers, Polar Vortices","Day/Night Rotation, Sunrises, Sunsets, Meteor Streaks, Aurorae, Wind, Jetstreams, Storms, Lightning, Cyclones, Cloud Pillars, Haze, Free-Floating Clouds, Sulfuric-Acid Rain, Diamond Rain, Hail, Snow",8,8,2,,,,5,1,-102,-1161,-,,,,,,,,,,,,,,,,,,,,,,,,,,,,Exists,#NUM!,3,Moon,Moon,DSN-4141 II a,Micro,Micro,10,,,,,,3,2,,-,,,Minimoon,Rocky Surface,"Synchronized Rotation, Sunrises, Sunsets",10,Usually Not Eclipsed,,,-141,-1242,3,Exist,Icy Sil.,#NUM!,DSN-4141 II Gr.,954,-669,#NUM!,DSN-4141 II Tr.,-1056,-493,Exists,270,#NUM!,-217,-1115,Exists,22.5,#NUM!,821,332
415,DSN-4151,-71,32,392,414,416,,#NUM!,Dwarf,Orange,K,2,7,-,DSN-4151 Alpha,Binary,132,-229,#NUM!,Dwarf,Red,M,1,DSN-4151 Beta,-132,229,Detached,,,,,,,,,,,,,,0,0,0,0,5,No Ice,1,0,0,0,0,6,0,Exists,#NUM!,DSN-4151 Alpha I,5,Gas Giant,,,Large,Massive,1,11,7,6,0,0,,,2,,,Sparse Sulfuric-Acid Clouds,Eyeball Giant,"Atmospheric Bands, Cloud Layers, Polar Vortices","Synchronized Rotation, Meteor Streaks, Aurorae, Wind, Jetstreams, Storms, Lightning, Cyclones, Cloud Pillars, Haze, Free-Floating Clouds, Sulfuric-Acid Rain, Diamond Rain, Hail, Snow",1,-1,0,,,,10,2,227,-167,-,,,,,,,,,,,,,,,,,,,,,,,,,,,,,,,,,,-,,,,,,,,,,,,,,,,,,,,,,,,,,,,,,,,,,-,,,,,,,,,,,,,,,,,,,,,,,,,,,,-,,,,,,,,,,,,,,,,,,,,,,,,,,,,,,-,,,,,,,,,,Exists,0,#NUM!,386,-251,-,,,,
416,DSN-4161,-29,68,393,415,,,#NUM!,Dwarf,Red,M,1,10,-,DSN-4161 Alpha,Binary,-265,-248,#NUM!,Dwarf,Red,M,1,DSN-4161 Beta,265,248,Detached,,,,,,,,,,,,,,0,0,0,0,3,Ice,1,0,0,0,0,7,0,-,,,,,,,,,,,,,,,,,,,,,,,,,,,,,,,,,,Exists,#NUM!,DSN-4161 Beta I,3,Gas Giant,,,Small,Massive,1,11,0,7,0,0,,,8,,,Global Sulfuric-Acid Cloud Layers,Eyeball Giant,"Atmospheric Bands, Cloud Layers, Polar Vortices","Synchronized Rotation, Meteor Streaks, Aurorae, Wind, Jetstreams, Storms, Lightning, Cyclones, Cloud Pillars, Haze, Free-Floating Clouds, Sulfuric-Acid Rain, Diamond Rain, Hail, Snow",1,-1,0,,,,7,3,337,168,Exists,#NUM!,DSN-4161 Beta II,3,Rocky Planet,3,,Medium,Medium,0,5,5,4,0,2,4,3,0,-,,No Clouds,Dry Planet,"Mountains, Plains, Dunes, Volcanoes","Day/Night Rotation, Sunrises, Sunsets, Meteor Streaks, Aurorae, Ash Rain, Lava Flows, Volcanic Eruptions, Volcanic Lightning, Ash Devils, Ash Blizzards, Wind, Dust Devils, Dust Storms",2,1,3,,,,9,3,492,284,Exists,#NUM!,3,Rock Ring,DSN-4161 Beta II a,,,,,,,,,,,,,,,Rocky Ring,"Rocks, Boulders, Dust, Gaps, Ringlets, Spiral Waves, Clusters, Clumps, Shepherd Moons, Gap Moonlets, Propeller Moonlets",,8,Usually Not Eclipsed,,,483,230,-,,,,,,,,,,,,,,,,,,,,,,,,,,,,,,-,,,,,,,,,,-,,,,,Exists,270,#NUM!,-43,171
417,DSN-4173,-18,244,394,,418,440,#NUM!,Dwarf,Red,M,1,10,-,DSN-4173 Alpha,Binary,132,152,#NUM!,Dwarf,Red,M,1,DSN-4173 Beta,-132,-152,Detached,,,,,,,,,,,,,,0,0,0,0,0,Ice,0,0,0,0,0,7,0,Exists,#NUM!,DSN-4173 Alpha I,4,Rocky Planet,0,,Small,Light,1,0,,,,,5,2,0,-,,No Clouds,Eyeball Planet,"Mountains, Plains, Craters","Synchronized Rotation, Meteor Impacts",2,-1,0,,,,3,2,42,68,-,,,,,,,,,,,,,,,,,,,,,,,,,,,,,,,,,,Exists,#NUM!,DSN-4173 AB I,0,Rocky Planet,0,,Small,Light,0,0,,,,,0,0,0,Partial Global Ammonia-Ice Shell,,No Clouds,Mixed Planet,"Mountains, Plains, Ammonia-Ice Glaciers, Craters","Day/Night Rotation, Sunrises, Sunsets, Meteor Impacts",6,4,4,,,,11,2,535,465,-,,,,,,,,,,,,,,,,,,,,,,,,,,,,-,,,,,,,,,,,,,,,,,,,,,,,,,,,,,,-,,,,,,,,,,Exists,112.5,#NUM!,85,246,-,,,,
418,DSN-4180,-34,266,395,417,,441,#NUM!,Giant,Blue,B,7,5,-,DSN-4180 Alpha,Binary,5,-270,#NUM!,Dwarf,Brown,Br.,0,DSN-4180 Beta,-9,540,Detached,,,,,,,,,,,,,,0,0,0,0,4,No Ice,1,0,0,0,0,2,0,-,,,,,,,,,,,,,,,,,,,,,,,,,,,,,,,,,,Exists,#NUM!,DSN-4180 Beta I,7,Large Asteroid,,Silicate,Small,Micro,1,,,,,,,,,-,,,Asteroid,Rocky Surface,Rotation,1,-1,0,,,,8,3,101,502,-,,,,,,,,,,,,,,,,,,,,,,,,,,,,,,,,,,-,,,,,,,,,,,,,,,,,,,,,,,,,,,,-,,,,,,,,,,,,,,,,,,,,,,,,,,,,,,-,,,,,,,,,,-,,,,,Exists,45,#NUM!,440,286
419,DSN-4199,46,439,,,420,442,#NUM!,Dwarf,Yellow-White,F,4,5,-,DSN-4199 Alpha,Binary,-25,23,#NUM!,Dwarf,Red,M,1,DSN-4199 Beta,25,-23,Contact,,,,,,,,,,,,,,0,0,0,0,4,No Ice,1,0,0,0,0,5,0,Exists,#NUM!,DSN-4199 AB I,7,Large Asteroid,,Carbonaceous,Small,Micro,0,,,,,,,,,-,,,Asteroid,Rocky Surface,Rotation,4,1,1,,,,15,1,-206,246,Exists,#NUM!,DSN-4199 AB II,3,Large Asteroid,,Silicate,Small,Micro,0,,,,,,,,,-,,,Asteroid,Rocky Surface,Rotation,7,5,4,,,,15,2,-462,495,-,,,,,,,,,,,,,,,,,,,,,,,,,,,,,,,,,,-,,,,,,,,,,,,,,,,,,,,,,,,,,,,-,,,,,,,,,,,,,,,,,,,,,,,,,,,,,,-,,,,,,,,,,Exists,270,#NUM!,-24,-233,-,,,,
420,DSN-4204,129,478,397,419,421,,#NUM!,Dwarf,Red,M,1,10,-,DSN-4204,Single,0,0,,,,,,,,,,,,,,,,,,,,,,,0,0,0,0,9,Ice,2,0,0,0,0,3,0,Exists,#NUM!,DSN-4204 I,2,Large Asteroid,,Ice,Small,Micro,0,,,,,,,,,Surface Ice,,,Icy Asteroid,"Rocky Surface, Ice",Rotation,3,4,0,,,,2,1,-239,-97,Exists,#NUM!,DSN-4204 II,0,Rocky Planet,0,,Large,Heavy,0,0,,,,,0,0,0,Global Water-Ice Glaciers,,No Clouds,Mixed Planet,"Mountains, Plains, Water-Ice Glaciers, Craters","Day/Night Rotation, Sunrises, Sunsets, Meteor Impacts",6,2,2,,,,5,1,0,-642,Exists,#NUM!,DSN-4204 III,0,Rocky Planet,0,,Small,Light,0,0,,,,,0,0,0,Global Water-Ice Shell,,No Clouds,Ice-Shell Planet,"Mountains, Plains, Craters","Day/Night Rotation, Sunrises, Sunsets, Meteor Impacts",8,1,1,,,,15,2,-627,526,-,,,,,,,,,,,,,,,,,,,,,,,,,,,,-,,,,,,,,,,,,,,,,,,,,,,,,,,,,,,-,,,,,,,,,,-,,,,,-,,,,
421,DSN-4214,112,603,,420,422,444,#NUM!,Giant,Blue,B,7,5,-,DSN-4214,Single,0,0,,,,,,,,,,,,,,,,,,,,,,,0,0,0,0,0,No Ice,0,0,0,0,0,2,0,Exists,#NUM!,DSN-4214 I,9,Rocky Planet,10,,Small,Light,0,2,0,2,0,2,10,9,3,Deep Global Lava Ocean,,Abundant Ash Clouds,Lava Planet,Lava Ocean,"Day/Night Rotation, Sunrises, Sunsets, Meteor Impacts, Meteor Streaks, Aurorae, Ash Rain, Volcanic Lightning, Ash Devils, Wind Storms, Ash Blizzards, Lava Tsunamis",2,4,1,,,,15,2,-86,118,-,,,,,,,,,,,,,,,,,,,,,,,,,,,,,,,,,,Exists,#NUM!,DSN-4214 II,5,Rocky Planet,8,,Large,Heavy,0,5,1,5,0,4,7,6,9,-,,Global Ammonia Cloud Cover,Shrouded Planet,"Mountains, Plains, Dunes, Volcanoes","Day/Night Rotation, Ash Rain, Lava Flows, Volcanic Eruptions, Volcanic Lightning, Ash Devils, Ash Blizzards, Wind, Dust Devils, Dust Storms, Lightning, Atmospheric Ammonia Rain, Tornadoes, Storms",7,8,6,Widespread Carbon-Ammonia Life,Primarily on the Land,1,16,2,-817,314,Exists,#NUM!,3,Moon,DSN-4214 II a,Micro,Micro,6,,,,,,5,4,,-,,,Minimoon,"Gravitational Rounding, Rocky Surface","Synchronized Rotation, Sunrises, Sunsets",6,Usually Not Eclipsed,,,-768,288,-,,,,,,,,,,,,,,,,,,,,,,,,,,,,,,-,,,,,,,,,,-,,,,,Exists,315,#NUM!,205,-166
422,DSN-4223,152,704,,421,423,445,#NUM!,Dwarf,Red,M,1,10,-,DSN-4223,Single,0,0,,,,,,,,,,,,,,,,,,,,,,,0,0,0,0,4,Ice,1,0,0,0,0,3,0,-,,,,,,,,,,,,,,,,,,,,,,,,,,,,,,,,,,-,,,,,,,,,,,,,,,,,,,,,,,,,,,,,,,,,,-,,,,,,,,,,,,,,,,,,,,,,,,,,,,,,,,,,-,,,,,,,,,,,,,,,,,,,,,,,,,,,,-,,,,,,,,,,,,,,,,,,,,,,,,,,,,,,-,,,,,,,,,,Exists,0,#NUM!,269,-47,-,,,,
423,DSN-4230,200,797,400,422,424,446,#NUM!,Dwarf,Red,M,1,10,-,DSN-4230 Alpha,Binary,4,-207,#NUM!,Dwarf,Red,M,1,DSN-4230 Beta,-4,207,Detached,,,,,,,,,,,,,,0,0,0,0,6,Ice,2,0,0,0,0,7,0,-,,,,,,,,,,,,,,,,,,,,,,,,,,,,,,,,,,-,,,,,,,,,,,,,,,,,,,,,,,,,,,,,,,,,,Exists,#NUM!,DSN-4230 AB I,0,Rocky Planet,0,,Medium,Medium,0,0,,,,,0,0,0,-,,No Clouds,Dry Planet,"Mountains, Plains, Craters","Day/Night Rotation, Sunrises, Sunsets, Meteor Impacts",6,3,1,,,,2,1,-689,-431,-,,,,,,,,,,,,,,,,,,,,,,,,,,,,-,,,,,,,,,,,,,,,,,,,,,,,,,,,,,,-,,,,,,,,,,Exists,0,#NUM!,32,10,-,,,,
424,DSN-4248,217,871,,423,425,447,#NUM!,Dwarf,Yellow,G,3,5,-,DSN-4248 Alpha,Binary,-54,105,#NUM!,Dwarf,Yellow-White,F,4,DSN-4248 Beta,54,-105,Detached,,,,,,,,,,,,,,0,0,0,0,1,No Ice,0,0,0,0,0,3,0,Exists,#NUM!,DSN-4248 AB I,9,Gas Giant,,,Small,Massive,0,11,4,0,0,0,,,8,,,Global Iron Cloud Layers,Hot Giant,"Atmospheric Bands, Cloud Layers, Polar Vortices","Day/Night Rotation, Sunrises, Sunsets, Meteor Streaks, Aurorae, Wind, Jetstreams, Storms, Lightning, Cyclones, Cloud Pillars, Haze, Free-Floating Clouds, Liquid-Iron Rain, Diamond Rain, Nightside Heat-Glow",3,2,1,,,,2,2,-235,-125,-,,,,,,,,,,,,,,,,,,,,,,,,,,,,,,,,,,Exists,#NUM!,DSN-4248 AB II,0,Rocky Planet,0,,Small,Light,0,0,,,,,0,0,0,Global Ammonia-Ice Glaciers,,No Clouds,Mixed Planet,"Mountains, Plains, Ammonia-Ice Glaciers, Craters","Day/Night Rotation, Sunrises, Sunsets, Meteor Impacts",9,3,0,Marginal Carbon-Ammonia Life,in the Clouds,,2,3,-1044,-222,Exists,#NUM!,3,Moon,DSN-4248 AB II a,Small,Light,3,0,,,,,0,0,1,Partial Global Water-Ice Shell,,Sparse Water Clouds,Mixed Moon,"Gravitational Rounding, Mountains, Plains, Water-Ice Glaciers, Volcanoes, Craters","Synchronized Rotation, Sunrises, Sunsets, Meteor Impacts, Ash Rain, Lava Flows, Volcanic Eruptions, Volcanic Lightning, Water Snow, Water Frost, Blizzards, Avalanches, Snow Devils",10,Usually Not Eclipsed,,,-1098,-213,-,,,,,,,,,,,,,,,,,,,,,,,,,,,,,,-,,,,,,,,,,-,,,,,-,,,,
425,DSN-4254,248,935,,424,,448,#NUM!,Dwarf,Yellow-White,F,4,5,-,DSN-4254 Alpha,Binary,-425,708,#NUM!,Dwarf,Red,M,1,DSN-4254 Beta,425,-708,Detached,,,,,,,,,,,,,,0,0,0,0,10,No Ice,3,0,0,0,0,5,0,Exists,#NUM!,DSN-4254 Alpha I,4,Gas Giant,,,Large,Massive,0,11,1,0,0,0,,,2,,,Sparse Sulfuric-Acid Clouds,Gas Giant,"Atmospheric Bands, Cloud Layers, Polar Vortices","Day/Night Rotation, Sunrises, Sunsets, Meteor Streaks, Aurorae, Wind, Jetstreams, Storms, Lightning, Cyclones, Cloud Pillars, Haze, Free-Floating Clouds, Sulfuric-Acid Rain, Diamond Rain, Hail, Snow",4,1,9,,,,4,3,-547,310,Exists,#NUM!,DSN-4254 Beta I,3,Gas Giant,,,Small,Massive,0,11,2,0,0,0,,,8,,,Global Sulfuric-Acid Cloud Layers,Gas Giant,"Atmospheric Bands, Cloud Layers, Polar Vortices","Day/Night Rotation, Sunrises, Sunsets, Meteor Streaks, Aurorae, Wind, Jetstreams, Storms, Lightning, Cyclones, Cloud Pillars, Haze, Free-Floating Clouds, Sulfuric-Acid Rain, Diamond Rain, Hail, Snow",2,8,2,,,,6,1,455,-847,Exists,#NUM!,DSN-4254 Beta II,2,Gas Giant,,,Large,Massive,0,11,0,0,10,0,,,2,,,Sparse Sulfuric-Acid Clouds,Gas Giant,"Atmospheric Bands, Cloud Layers, Polar Vortices","Day/Night Rotation, Sunrises, Sunsets, Meteor Streaks, Aurorae, Wind, Jetstreams, Storms, Lightning, Cyclones, Cloud Pillars, Haze, Free-Floating Clouds, Sulfuric-Acid Rain, Diamond Rain, Hail, Snow",4,10,2,,,,1,2,46,-775,Exists,#NUM!,3,Moon,DSN-4254 Beta II a,Micro,Micro,0,,,,,,2,1,,Surface Ice,Polar Water-Ice Glaciers,,Icy Minimoon,"Gravitational Rounding, Rocky Surface, Ice","Synchronized Rotation, Sunrises, Sunsets",4,Eclipsed Each Day,,,98,-757,-,,,,,,,,,,,,,,,,,,,,,,,,,,,,,3,Exist,Icy Carb.,#NUM!,DSN-4254 Beta II Gr.,293,-1070,#NUM!,DSN-4254 Beta II Tr.,178,-413,-,,,,,-,,,,
426,DSN-4263,295,1091,403,,,449,#NUM!,Dwarf,Orange,K,2,7,-,DSN-4263 Alpha,Binary,552,201,#NUM!,Dwarf,Red,M,1,DSN-4263 Beta,-552,-201,Detached,,,,,,,,,,,,,,0,0,0,0,2,No Ice,1,0,0,0,0,6,0,-,,,,,,,,,,,,,,,,,,,,,,,,,,,,,,,,,,-,,,,,,,,,,,,,,,,,,,,,,,,,,,,,,,,,,-,,,,,,,,,,,,,,,,,,,,,,,,,,,,,,,,,,-,,,,,,,,,,,,,,,,,,,,,,,,,,,,-,,,,,,,,,,,,,,,,,,,,,,,,,,,,,,-,,,,,,,,,,-,,,,,-,,,,
427,DSN-4279,-556,-935,404,,428,450,#NUM!,Giant,Blue-Violet,O,9,5,-,DSN-4279,Single,0,0,,,,,,,,,,,,,,,,,,,,,,,0,0,0,0,7,No Ice,2,0,0,0,0,2,0,Exists,#NUM!,DSN-4279 I,10,Gas Giant,,,Small,Massive,0,11,7,5,0,0,,,6,,,Abundant Iron Clouds,Hot Giant,"Atmospheric Bands, Cloud Layers, Polar Vortices","Day/Night Rotation, Sunrises, Sunsets, Meteor Streaks, Aurorae, Wind, Jetstreams, Storms, Lightning, Cyclones, Cloud Pillars, Haze, Free-Floating Clouds, Liquid-Iron Rain, Diamond Rain, Nightside Heat-Glow",3,2,5,,,,9,3,233,37,Exists,#NUM!,DSN-4279 II,8,Rocky Planet,10,,Medium,Medium,0,5,0,0,4,5,8,7,8,-,,Global Water Cloud Cover,Shrouded Planet,"Mountains, Plains, Dunes, Volcanoes","Day/Night Rotation, Ash Rain, Lava Flows, Volcanic Eruptions, Volcanic Lightning, Ash Devils, Ash Blizzards, Wind, Dust Devils, Dust Storms, Lightning, Atmospheric Water Rain, Tornadoes, Storms",5,10,5,Marginal Carbon-Water Life,in the Clouds,,9,3,602,-32,Exists,#NUM!,DSN-4279 III,7,Gas Giant,,,Large,Massive,0,11,0,0,0,0,,,8,,,Global Iron Cloud Layers,Hot Giant,"Atmospheric Bands, Cloud Layers, Polar Vortices","Day/Night Rotation, Sunrises, Sunsets, Meteor Streaks, Aurorae, Wind, Jetstreams, Storms, Lightning, Cyclones, Cloud Pillars, Haze, Free-Floating Clouds, Liquid-Iron Rain, Diamond Rain, Nightside Heat-Glow",7,6,3,,,,16,3,-829,253,-,,,,,,,,,,,,,,,,,,,,,,,,,,,,-,,,,,,,,,,,,,,,,,,,,,,,,,,,,,,-,,,,,,,,,,Exists,202.5,#NUM!,-731,-182,Exists,247.5,#NUM!,-542,-834
428,DSN-4288,-565,-853,405,427,,451,#NUM!,Dwarf,Red,M,1,10,-,DSN-4288 Alpha,Binary,-520,800,#NUM!,Giant,Blue,B,7,DSN-4288 Beta,260,-400,Detached,,,,,,,,,,,,,,0,0,0,0,0,No Ice,0,0,0,0,0,5,0,-,,,,,,,,,,,,,,,,,,,,,,,,,,,,,,,,,,Exists,#NUM!,DSN-4288 Beta I,9,Gas Giant,,,Small,Massive,1,11,0,0,3,0,,,4,,,Abundant Iron Clouds,Eyeball Giant,"Atmospheric Bands, Cloud Layers, Polar Vortices","Synchronized Rotation, Meteor Streaks, Aurorae, Wind, Jetstreams, Storms, Lightning, Cyclones, Cloud Pillars, Haze, Free-Floating Clouds, Liquid-Iron Rain, Diamond Rain, Nightside Heat-Glow",1,-1,0,,,,5,1,244,-515,Exists,#NUM!,DSN-4288 Beta II,7,Rocky Planet,10,,Large,Heavy,0,8,2,0,0,8,7,6,10,Deep Global Water Ocean,,Global Water Cloud Cover,Shrouded Planet,Water Ocean,"Day/Night Rotation, Wind, Water Rain, Fog, Water-Spouts, Lightning, Sea Storms, Hurricanes, Tsunamis",4,3,2,Marginal Carbon-Water Life,in the Oceans/Lakes,,4,2,137,-804,-,,,,,,,,,,,,,,,,,,,,,,,,,,,,-,,,,,,,,,,,,,,,,,,,,,,,,,,,,,,-,,,,,,,,,,Exists,202.5,#NUM!,-598,-766,-,,,,
