264,DSN-2640,793,663,241,,265,287,847,Dwarf,Yellow,G,3,5,-,DSN-2640 Alpha,Binary,-250,-188,848,Dwarf,Red,M,1,DSN-2640 Beta,250,188,Detached,,,,,,,,,,,,,,0,0,0,0,9,No Ice,2,0,0,0,0,5,0,-,,,,,,,,,,,,,,,,,,,,,,,,,,,,,,,,,,Exists,849,DSN-2640 Beta I,5,Rocky Planet,0,,Small,Light,0,2,2,0,0,0,5,4,3,-,,Abundant Ammonia Clouds,Dry Planet,"Mountains, Plains, Dunes, Craters","Day/Night Rotation, Sunrises, Sunsets, Meteor Impacts, Meteor Streaks, Aurorae, Wind, Dust Devils, Dust Storms, Lightning, Atmospheric Ammonia Rain, Tornadoes, Storms",2,5,4,Marginal Carbon-Ammonia Life,in the Clouds,,5,2,260,-8,Exists,850,DSN-2640 AB I,0,Rocky Planet,0,,Large,Heavy,0,0,,,,,0,0,0,Global Sulfuric-Acid-Ice Glaciers,,No Clouds,Mixed Planet,"Mountains, Plains, Sulfuric-Acid-Ice Glaciers, Craters","Day/Night Rotation, Sunrises, Sunsets, Meteor Impacts",8,10,5,Marginal Carbon-Sulfuric-Acid Life,in the Clouds,,15,1,-702,780,-,,,,,,,,,,,,,,,,,,,,,,,,,,,,-,,,,,,,,,,,,,,,,,,,,,,,,,,,,,,-,,,,,,,,,,-,,,,,-,,,,
265,DSN-2654,862,710,242,264,,288,851,Dwarf,Blue-White,A,5,5,-,DSN-2654,Single,0,0,,,,,,,,,,,,,,,,,,,,,,,0,0,0,0,7,No Ice,2,0,0,0,0,2,0,Exists,852,DSN-2654 I,7,Rocky Planet,10,,Small,Light,0,3,3,0,0,3,7,6,0,-,,No Clouds,Dry Planet,"Mountains, Plains, Dunes, Volcanoes","Day/Night Rotation, Sunrises, Sunsets, Meteor Streaks, Aurorae, Ash Rain, Lava Flows, Volcanic Eruptions, Volcanic Lightning, Ash Devils, Ash Blizzards, Wind, Dust Devils, Dust Storms",2,8,8,,,,13,3,0,137,Exists,853,DSN-2654 II,5,Rocky Planet,9,,Medium,Medium,0,6,0,3,0,5,6,5,3,Global Sulfuric-Acid Lakes,,Abundant Sulfuric-Acid Clouds,Mixed Planet,"Mountains, Plains, Dunes, Volcanoes, Sulfuric-Acid Lakes, Sulfuric-Acid Rivers, Canyons","Day/Night Rotation, Sunrises, Sunsets, Meteor Streaks, Aurorae, Ash Rain, Lava Flows, Volcanic Eruptions, Volcanic Lightning, Ash Devils, Ash Blizzards, Wind, Dust Devils, Dust Storms, Lightning, Sulfuric-Acid Rain, Fog, Tornadoes, Storms, Landslides, Sinkholes, Sulfuric-Acid Dew",6,5,2,Superabundant Silicon-Sulfuric-Acid Life,Primarily on the Land,Green,3,1,-339,-404,Exists,854,DSN-2654 III,2,Gas Giant,,,Large,Massive,0,11,9,0,0,0,,,0,,,No Clouds,Gas Giant,"Atmospheric Bands, Cloud Layers, Polar Vortices","Day/Night Rotation, Sunrises, Sunsets, Meteor Streaks, Aurorae, Wind, Jetstreams, Storms, Lightning, Cyclones, Cloud Pillars, Haze, Free-Floating Clouds, Sulfuric-Acid Rain, Diamond Rain, Hail, Snow",9,4,3,,,,10,2,935,416,-,,,,,,,,,,,,,,,,,,,,,,,,,,,,-,,,,,,,,,,,,,,,,,,,,,,,,,,,,,,-,,,,,,,,,,-,,,,,-,,,,
266,DSN-2661,54,-1090,243,,267,289,855,Dwarf,Red,M,1,10,-,DSN-2661,Single,0,0,,,,,,,,,,,,,,,,,,,,,,,0,0,0,0,2,Ice,1,0,0,0,0,3,0,Exists,856,DSN-2661 I,3,Rocky Planet,0,,Small,Light,0,2,1,0,0,0,3,2,0,-,,No Clouds,Dry Planet,"Mountains, Plains, Dunes, Craters","Day/Night Rotation, Sunrises, Sunsets, Meteor Impacts, Meteor Streaks, Aurorae, Wind, Dust Devils, Dust Storms",3,4,3,,,,11,3,132,162,-,,,,,,,,,,,,,,,,,,,,,,,,,,,,,,,,,,-,,,,,,,,,,,,,,,,,,,,,,,,,,,,,,,,,,Exists,857,1,Rock Ring,DSN-2661 I a,,,,,,,,,,,,,,,Rocky Ring,"Rocks, Boulders, Dust, Gaps, Ringlets, Spiral Waves, Clusters, Clumps, Shepherd Moons, Gap Moonlets, Propeller Moonlets",,10,Usually Not Eclipsed,,,132,217,-,,,,,,,,,,,,,,,,,,,,,,,,,,,,,,-,,,,,,,,,,Exists,22.5,859,108,44,-,,,,
267,DSN-2673,85,-991,244,266,268,290,860,Giant,Blue-Violet,O,9,5,-,DSN-2673 Alpha,Triple,70,116,861,Dwarf,Red,M,1,DSN-2673 Beta,-139,-231,Detached,,,,,862,Dwarf,Brown,Br.,0,0,DSN-2673 Gamma,-587,725,0,0,0,0,8,No Ice,2,0,0,0,0,5,0,Exists,863,DSN-2673 Alpha I,10,Gas Giant,,,Medium,Massive,1,11,0,4,0,0,,,0,,,No Clouds,Eyeball Giant,"Atmospheric Bands, Cloud Layers, Polar Vortices","Synchronized Rotation, Meteor Streaks, Aurorae, Wind, Jetstreams, Storms, Lightning, Cyclones, Cloud Pillars, Haze, Free-Floating Clouds, Liquid-Iron Rain, Diamond Rain, Nightside Heat-Glow",1,-1,0,,,,3,2,-21,37,Exists,864,DSN-2673 Beta I,10,Rocky Planet,10,,Medium,Medium,1,6,0,4,0,6,12,9,3,Dayside Lava Ocean,Nightside Volcanic Crust,Abundant Ash Clouds,Eyeball Planet,"Lava Ocean, Islands, Nightside Crust Cap","Synchronized Rotation, Meteor Streaks, Aurorae, Ash Rain, Volcanic Lightning, Ash Devils, Wind Storms, Ash Blizzards, Lava Tsunamis, Crust Calving",1,-1,0,,,,11,2,-75,-136,Exists,865,DSN-2673 Gamma I,9,Rocky Planet,10,,Small,Light,1,2,0,0,2,2,10,7,3,Dayside Lava Ocean,Nightside Volcanic Crust,Abundant Ash Clouds,Eyeball Planet,"Lava Ocean, Islands, Nightside Crust Cap","Synchronized Rotation, Meteor Impacts, Meteor Streaks, Aurorae, Ash Rain, Volcanic Lightning, Ash Devils, Wind Storms, Ash Blizzards, Lava Tsunamis, Crust Calving",1,-1,0,,,,2,1,-690,665,-,,,,,,,,,,,,,,,,,,,,,,,,,,,,-,,,,,,,,,,,,,,,,,,,,,,,,,,,,,,-,,,,,,,,,,-,,,,,Exists,112.5,866,-478,570
268,DSN-2685,120,-873,245,267,269,,867,Dwarf,Yellow-White,F,4,5,-,DSN-2685 Alpha,Binary,54,-440,868,Dwarf,Red,M,1,DSN-2685 Beta,-54,440,Detached,,,,,,,,,,,,,,0,0,0,0,1,No Ice,0,0,0,0,0,5,0,Exists,869,DSN-2685 Alpha I,6,Rocky Planet,1,,Large,Heavy,0,9,4,4,0,1,7,6,9,Global Water Ocean,,Global Water Cloud Cover,Shrouded Planet,"Water Ocean, Islands","Day/Night Rotation, Wind, Water Rain, Fog, Water-Spouts, Lightning, Sea Storms, Hurricanes, Tsunamis, Landslides, Sinkholes, Water Dew",2,0,1,Sparse Carbon-Water Life,Primarily in the Clouds,Black,10,2,196,-380,Exists,870,DSN-2685 Beta I,4,Rocky Planet,1,,Medium,Medium,1,7,0,2,0,1,6,3,4,Partial Dayside Water Oceans,Partial Nightside Water-Ice Shell,Abundant Water Clouds,Eyeball Planet,"Mountains, Plains, Dunes, Water-Ice Glaciers, Nightside Water-Ice Cap, Volcanoes, Water Lakes, Water Rivers, Canyons, Water Oceans","Synchronized Rotation, Meteor Streaks, Aurorae, Ash Rain, Wind, Dust Devils, Dust Storms, Water Snow, Water Frost, Blizzards, Avalanches, Snow Devils, Water Cryvolcanic Eruptions, Ice Rain, Lightning, Water Rain, Fog, Tornadoes, Storms, Landslides, Sinkholes, Water Dew, Hurricanes, Tsunamis, Sea Storms, Water-Spouts, Ice Calving, Water-Icebergs, Hail",1,-1,0,,,,8,3,46,411,-,,,,,,,,,,,,,,,,,,,,,,,,,,,,,,,,,,-,,,,,,,,,,,,,,,,,,,,,,,,,,,,-,,,,,,,,,,,,,,,,,,,,,,,,,,,,,,-,,,,,,,,,,Exists,67.5,871,-7,-48,Exists,45,872,418,-128
269,DSN-2698,140,-771,246,268,270,,873,Dwarf,Brown,Br.,0,0,-,DSN-2698 Alpha,Binary,-327,363,874,Dwarf,Red,M,1,DSN-2698 Beta,327,-363,Detached,,,,,,,,,,,,,,0,0,0,0,7,Ice,2,0,0,0,0,3,0,Exists,875,DSN-2698 Alpha I,2,Gas Giant,,,Large,Massive,0,11,11,4,0,0,,,10,,,Global Sulfuric-Acid Cloud Layers,Gas Giant,"Atmospheric Bands, Cloud Layers, Polar Vortices","Day/Night Rotation, Sunrises, Sunsets, Meteor Streaks, Aurorae, Wind, Jetstreams, Storms, Lightning, Cyclones, Cloud Pillars, Haze, Free-Floating Clouds, Sulfuric-Acid Rain, Diamond Rain, Hail, Snow",2,10,5,Marginal Carbon-Sulfuric-Acid Life,in the Clouds,,13,3,-313,568,Exists,876,DSN-2698 Beta I,3,Rocky Planet,1,,Small,Light,1,2,2,0,0,0,4,1,3,,Nightside Water-Ice Glaciers,Abundant Water Clouds,Eyeball Planet,"Mountains, Plains, Dunes, Water-Ice Glaciers, Nightside Water-Ice Cap, Water Lakes, Water Rivers, Canyons, Volcanoes, Craters","Synchronized Rotation, Meteor Impacts, Meteor Streaks, Aurorae, Ash Rain, Wind, Dust Devils, Dust Storms, Water Snow, Water Frost, Blizzards, Avalanches, Snow Devils, Lightning, Water Rain, Fog, Tornadoes, Storms, Landslides, Sinkholes, Water Dew",1,-1,0,Marginal Silicon-Water Life,Primarily in the Oceans/Lakes,,11,2,415,-301,Exists,877,DSN-2698 Beta II,2,Large Asteroid,,Ice,Medium,Micro,0,,,,,,,,,Surface Ice,,,Icy Asteroid,"Rocky Surface, Ice",Rotation,3,6,0,,,,12,3,433,-114,Exists,878,1,Moon,DSN-2698 Alpha I a,Small,Light,0,3,0,2,0,0,3,2,0,-,,,Dry Moon,"Gravitational Rounding, Mountains, Plains, Dunes, Craters","Synchronized Rotation, Sunrises, Sunsets, Meteor Streaks, Aurorae, Wind, Dust Devils, Dust Storms",4,Eclipsed Each Day,,,-306,623,-,,,,,,,,,,,,,,,,,,,,,,,,,,,,,,-,,,,,,,,,,-,,,,,-,,,,
270,DSN-2700,136,-670,247,269,271,293,879,Dwarf,Red,M,1,10,-,DSN-2700,Single,0,0,,,,,,,,,,,,,,,,,,,,,,,0,0,0,0,1,Ice,0,0,0,0,0,3,0,-,,,,,,,,,,,,,,,,,,,,,,,,,,,,,,,,,,Exists,880,DSN-2700 I,1,Rocky Planet,6,,Small,Light,0,1,1,1,0,1,1,0,6,,Deep Polar Methane-Ice Shell,Abundant Methane Clouds,Mixed Planet,"Mountains, Plains, Dunes, Methane-Ice Glaciers, Polar Methane-Ice Caps, Methane Lakes, Methane Rivers, Canyons, Methane Oceans, Volcanoes","Day/Night Rotation, Sunrises, Sunsets, Meteor Impacts, Meteor Streaks, Aurorae, Ash Rain, Lava Flows, Volcanic Eruptions, Volcanic Lightning, Ash Devils, Ash Blizzards, Wind, Dust Devils, Dust Storms, Methane Snow, Methane Frost, Blizzards, Avalanches, Snow Devils, Methane Cryvolcanic Eruptions, Ice Rain, Lightning, Methane Rain, Fog, Tornadoes, Storms, Landslides, Sinkholes, Methane Dew",6,6,2,Marginal Carbon-Methane Life,on the Land,,7,3,422,-318,Exists,881,DSN-2700 II,0,Rocky Planet,0,,Medium,Medium,0,0,,,,,0,0,0,Global Ammonia-Ice Shell,,No Clouds,Ice-Shell Planet,"Mountains, Plains, Craters","Day/Night Rotation, Sunrises, Sunsets, Meteor Impacts",9,4,2,,,,12,3,295,1030,-,,,,,,,,,,,,,,,,,,,,,,,,,,,,-,,,,,,,,,,,,,,,,,,,,,,,,,,,,,,-,,,,,,,,,,-,,,,,-,,,,
271,DSN-2713,162,-540,248,270,272,294,882,Dwarf,Red,M,1,10,-,DSN-2713,Single,0,0,,,,,,,,,,,,,,,,,,,,,,,0,0,0,0,1,Ice,0,0,0,0,0,3,0,-,,,,,,,,,,,,,,,,,,,,,,,,,,,,,,,,,,-,,,,,,,,,,,,,,,,,,,,,,,,,,,,,,,,,,-,,,,,,,,,,,,,,,,,,,,,,,,,,,,,,,,,,-,,,,,,,,,,,,,,,,,,,,,,,,,,,,-,,,,,,,,,,,,,,,,,,,,,,,,,,,,,,-,,,,,,,,,,-,,,,,-,,,,
272,DSN-2720,182,-457,,271,273,295,883,Dwarf,Red,M,1,10,-,DSN-2720 Alpha,Triple,35,-7,884,Giant,Blue-Violet,O,9,DSN-2720 Beta,-18,4,Contact,,,,,885,Dwarf,Red,M,1,10,DSN-2720 Gamma,401,-695,0,0,0,0,5,No Ice,1,0,0,0,0,8,0,Exists,886,DSN-2720 AB I,10,Large Asteroid,,Silicate,Medium,Micro,0,,,,,,,,,-,,,Asteroid,Rocky Surface,Rotation,3,10,8,,,,10,3,158,99,Exists,887,DSN-2720 AB II,10,Rocky Planet,10,,Large,Heavy,0,5,0,0,3,5,10,9,3,Equatorial Lava Ocean,Polar Volcanic Crust,Abundant Ash Clouds,Lava Planet,"Lava Ocean, Islands, Polar Crust Caps","Day/Night Rotation, Sunrises, Sunsets, Meteor Streaks, Aurorae, Ash Rain, Volcanic Lightning, Ash Devils, Wind Storms, Ash Blizzards, Lava Tsunamis, Crust Calving",4,10,0,,,,7,2,260,-211,Exists,888,DSN-2720 Gamma I,9,Gas Giant,,,Small,Massive,0,11,9,5,0,0,,,3,,,Abundant Iron Clouds,Hot Giant,"Atmospheric Bands, Cloud Layers, Polar Vortices","Day/Night Rotation, Sunrises, Sunsets, Meteor Streaks, Aurorae, Wind, Jetstreams, Storms, Lightning, Cyclones, Cloud Pillars, Haze, Free-Floating Clouds, Liquid-Iron Rain, Diamond Rain, Nightside Heat-Glow",3,3,4,,,,10,3,638,-604,Exists,889,3,Moon,DSN-2720 Gamma I a,Micro,Micro,10,,,,,,9,8,,-,,,Minimoon,"Gravitational Rounding, Rocky Surface","Synchronized Rotation, Sunrises, Sunsets",8,Usually Not Eclipsed,,,660,-654,-,,,,,,,,,,,,,,,,,,,,,,,,,,,,,,-,,,,,,,,,,-,,,,,Exists,22.5,890,656,394
273,DSN-2737,200,-415,,272,274,296,891,Dwarf,Red,M,1,10,-,DSN-2737 Alpha,Binary,97,-925,892,Dwarf,Red,M,1,DSN-2737 Beta,-97,925,Detached,,,,,,,,,,,,,,0,0,0,0,0,Ice,0,0,0,0,0,7,0,Exists,893,DSN-2737 Alpha I,3,Gas Giant,,,Small,Massive,0,11,0,0,11,0,,,9,,,Global Sulfuric-Acid Cloud Layers,Gas Giant,"Atmospheric Bands, Cloud Layers, Polar Vortices","Day/Night Rotation, Sunrises, Sunsets, Meteor Streaks, Aurorae, Wind, Jetstreams, Storms, Lightning, Cyclones, Cloud Pillars, Haze, Free-Floating Clouds, Sulfuric-Acid Rain, Diamond Rain, Hail, Snow",2,2,0,Marginal Carbon-Sulfuric-Acid Life,in the Clouds,,1,1,-45,-940,-,,,,,,,,,,,,,,,,,,,,,,,,,,,,,,,,,,Exists,894,DSN-2737 Beta I,1,Gas Giant,,,Medium,Massive,0,11,0,1,0,0,,,2,,,Sparse Ammonia Clouds,Ice Giant,"Atmospheric Bands, Cloud Layers, Polar Vortices, Shrouded Supercritical-Fluid Ocean","Day/Night Rotation, Sunrises, Sunsets, Meteor Streaks, Aurorae, Wind, Jetstreams, Storms, Lightning, Cyclones, Cloud Pillars, Haze, Free-Floating Clouds, Ammonia Rain, Diamond Rain, Hail, Snow",4,6,0,,,,15,2,-481,1236,Exists,895,3,Moon,DSN-2737 Beta I a,Micro,Micro,0,,,,,,1,0,,Surface Ice,,,Icy Minimoon,"Rocky Surface, Ice","Synchronized Rotation, Sunrises, Sunsets",6,Usually Not Eclipsed,,,-489,1290,Exists,896,3,Moon,Moon,DSN-2737 Beta I b,Small,Light,10,2,0,0,0,2,1,0,2,Partial Global Water-Ice Shell,,Sparse Water Clouds,Mixed Moon,"Gravitational Rounding, Mountains, Plains, Dunes, Water-Ice Glaciers, Volcanoes","Synchronized Rotation, Sunrises, Sunsets, Meteor Impacts, Meteor Streaks, Aurorae, Ash Rain, Lava Flows, Volcanic Eruptions, Volcanic Lightning, Ash Devils, Ash Blizzards, Wind, Dust Devils, Dust Storms, Water Snow, Water Frost, Blizzards, Avalanches, Snow Devils, Water Cryvolcanic Eruptions, Ice Rain",10,Usually Not Eclipsed,,,-405,1188,3,Exist,Icy Carb.,897,DSN-2737 Beta I Gr.,-558,748,898,DSN-2737 Beta I Tr.,-20,1413,-,,,,,-,,,,
274,DSN-2742,333,-407,,273,275,297,899,Dwarf,Red,M,1,10,-,DSN-2742 Alpha,Binary,-74,119,900,Dwarf,Yellow,G,3,DSN-2742 Beta,74,-119,Detached,,,,,,,,,,,,,,0,0,0,0,9,No Ice,2,0,0,0,0,5,0,Exists,901,DSN-2742 AB I,6,Large Asteroid,,Carbonaceous,Small,Micro,0,,,,,,,,,-,,,Asteroid,Rocky Surface,Rotation,4,2,0,,,,7,2,287,-193,Exists,902,DSN-2742 AB II,2,Gas Giant,,,Large,Massive,0,11,3,0,0,0,,,7,,,Global Sulfuric-Acid Cloud Layers,Gas Giant,"Atmospheric Bands, Cloud Layers, Polar Vortices","Day/Night Rotation, Sunrises, Sunsets, Meteor Streaks, Aurorae, Wind, Jetstreams, Storms, Lightning, Cyclones, Cloud Pillars, Haze, Free-Floating Clouds, Sulfuric-Acid Rain, Diamond Rain, Hail, Snow",6,5,7,Marginal Carbon-Sulfuric-Acid Life,in the Clouds,,13,2,10,595,Exists,903,DSN-2742 AB III,1,Gas Giant,,,Large,Massive,0,11,0,0,0,0,,,1,,,Sparse Ammonia Clouds,Ice Giant,"Atmospheric Bands, Cloud Layers, Polar Vortices, Shrouded Supercritical-Fluid Ocean","Day/Night Rotation, Sunrises, Sunsets, Meteor Streaks, Aurorae, Wind, Jetstreams, Storms, Lightning, Cyclones, Cloud Pillars, Haze, Free-Floating Clouds, Ammonia Rain, Diamond Rain, Hail, Snow",7,3,0,,,,7,2,518,-555,-,,,,,,,,,,,,,,,,,,,,,,,,,,,,-,,,,,,,,,,,,,,,,,,,,,,,,,,,,,,-,,,,,,,,,,-,,,,,Exists,67.5,904,-151,-40
275,DSN-2752,328,-308,,274,276,298,905,Dwarf,Red,M,1,10,-,DSN-2752 Alpha,Binary,260,-219,906,Dwarf,Red,M,1,DSN-2752 Beta,-260,219,Detached,,,,,,,,,,,,,,0,0,0,0,9,Ice,2,0,0,0,0,7,0,Exists,907,DSN-2752 Alpha I,3,Large Asteroid,,Carbonaceous,Small,Micro,0,,,,,,,,,-,,,Asteroid,Rocky Surface,Rotation,2,0,0,,,,4,1,195,-342,Exists,908,DSN-2752 Beta I,3,Rocky Planet,2,,Medium,Medium,0,2,1,1,0,0,3,2,5,Equatorial Water Ocean,Polar Water-Ice Shell,Abundant Water Clouds,Oceanic Planet,"Water Ocean, Islands, Polar Water-Ice Caps","Day/Night Rotation, Sunrises, Sunsets, Meteor Impacts, Meteor Streaks, Aurorae, Wind, Water Rain, Fog, Water-Spouts, Lightning, Sea Storms, Hurricanes, Tsunamis, Landslides, Sinkholes, Water Dew, Water Snow, Water Frost, Water Hail, Ice Calving, Water-Icebergs, Blizzards, Snow Devils",2,6,4,Marginal Carbon-Water Life,in the Oceans/Lakes,,7,3,-91,72,Exists,909,DSN-2752 AB I,0,Large Asteroid,,Icy Carb.,Large,Micro,0,,,,,,,,,Surface Ice and Subsurface Ocean,,,Icy Asteroid,"Gravitational Rounding, Rocky Surface, Ice",Rotation,8,1,1,,,,10,3,922,533,Exists,910,2,Rock Ring,DSN-2752 Beta I a,,,,,,,,,,,,,,,Rocky Ring,"Rocks, Boulders, Dust, Gaps, Ringlets, Spiral Waves, Clusters, Clumps, Shepherd Moons, Gap Moonlets, Propeller Moonlets",,8,Usually Not Eclipsed,,,-146,78,-,,,,,,,,,,,,,,,,,,,,,,,,,,,,,,-,,,,,,,,,,-,,,,,-,,,,
276,DSN-2763,398,-284,253,275,,299,912,Dwarf,Orange,K,2,7,-,DSN-2763 Alpha,Binary,-695,-339,913,Giant,Blue-Violet,O,9,DSN-2763 Beta,348,170,Detached,,,,,,,,,,,,,,0,0,0,0,0,No Ice,0,0,0,0,0,4,0,-,,,,,,,,,,,,,,,,,,,,,,,,,,,,,,,,,,Exists,914,DSN-2763 Beta I,10,Rocky Planet,10,,Small,Light,0,2,1,0,0,2,10,9,3,Partial Global Lava Oceans,,Abundant Ash Clouds,Volcanic Planet,"Volcanoes, Mountains, Plains, Lava Oceans, Islands","Day/Night Rotation, Sunrises, Sunsets, Meteor Impacts, Meteor Streaks, Aurorae, Volcanic Eruptions, Ash Rain, Volcanic Lightning, Ash Devils, Wind Storms, Ash Blizzards, Lava Tsunamis",2,0,4,,,,4,1,293,39,-,,,,,,,,,,,,,,,,,,,,,,,,,,,,,,,,,,-,,,,,,,,,,,,,,,,,,,,,,,,,,,,-,,,,,,,,,,,,,,,,,,,,,,,,,,,,,,-,,,,,,,,,,Exists,247.5,915,-18,-204,Exists,315,916,626,-240
277,DSN-2771,501,-191,254,,278,300,917,Dwarf,Brown,Br.,0,0,-,DSN-2771 Alpha,Binary,493,-199,918,Dwarf,Yellow,G,3,DSN-2771 Beta,-493,199,Detached,,,,,,,,,,,,,,0,0,0,0,8,No Ice,2,0,0,0,0,2,0,-,,,,,,,,,,,,,,,,,,,,,,,,,,,,,,,,,,Exists,919,DSN-2771 Beta I,5,Large Asteroid,,Silicate,Large,Micro,1,,,,,,,,,-,,,Asteroid,"Gravitational Rounding, Rocky Surface",Rotation,1,-1,0,,,,3,1,-562,108,-,,,,,,,,,,,,,,,,,,,,,,,,,,,,,,,,,,-,,,,,,,,,,,,,,,,,,,,,,,,,,,,-,,,,,,,,,,,,,,,,,,,,,,,,,,,,,,-,,,,,,,,,,-,,,,,Exists,22.5,920,-139,327
278,DSN-2785,504,-111,255,277,279,,921,Dwarf,Red,M,1,10,-,DSN-2785 Alpha,Binary,35,-671,922,Giant,Blue,B,7,DSN-2785 Beta,-18,336,Detached,,,,,,,,,,,,,,0,0,0,0,0,No Ice,0,0,0,0,0,5,0,-,,,,,,,,,,,,,,,,,,,,,,,,,,,,,,,,,,-,,,,,,,,,,,,,,,,,,,,,,,,,,,,,,,,,,Exists,923,DSN-2785 Beta I,8,Rocky Planet,10,,Small,Light,0,3,2,0,0,3,8,7,2,-,,Sparse Water Clouds,Dry Planet,"Mountains, Plains, Dunes, Volcanoes","Day/Night Rotation, Sunrises, Sunsets, Meteor Streaks, Aurorae, Ash Rain, Lava Flows, Volcanic Eruptions, Volcanic Lightning, Ash Devils, Ash Blizzards, Wind, Dust Devils, Dust Storms",3,1,9,,,,8,3,242,256,Exists,924,3,Moon,DSN-2785 Beta I a,Micro,Micro,10,,,,,,8,7,,-,,,Minimoon,"Gravitational Rounding, Rocky Surface","Synchronized Rotation, Sunrises, Sunsets",10,Usually Not Eclipsed,,,193,282,-,,,,,,,,,,,,,,,,,,,,,,,,,,,,,,-,,,,,,,,,,-,,,,,-,,,,
279,DSN-2792,503,6,256,278,280,,925,Dwarf,Orange,K,2,7,-,DSN-2792,Single,0,0,,,,,,,,,,,,,,,,,,,,,,,0,0,0,0,1,No Ice,0,0,0,0,0,2,0,-,,,,,,,,,,,,,,,,,,,,,,,,,,,,,,,,,,-,,,,,,,,,,,,,,,,,,,,,,,,,,,,,,,,,,Exists,926,DSN-2792 I,0,Rocky Planet,0,,Small,Light,0,0,,,,,0,0,0,Deep Global Ammonia-Ice Shell and Subsurface Ocean,,No Clouds,Ice-Shell Planet,"Mountains, Plains, Subsurface Ammonia Ocean, Ammonia Cryovolcanoes, Craters","Day/Night Rotation, Sunrises, Sunsets, Meteor Impacts, Cryovolcanic Eruptions, Ammonia-Ice Rain",7,6,1,,,,8,2,674,-300,-,,,,,,,,,,,,,,,,,,,,,,,,,,,,-,,,,,,,,,,,,,,,,,,,,,,,,,,,,,,-,,,,,,,,,,-,,,,,-,,,,
280,DSN-2806,445,82,,279,281,303,927,Dwarf,Red,M,1,10,-,DSN-2806 Alpha,Binary,-312,66,928,Dwarf,Red,M,1,DSN-2806 Beta,312,-66,Detached,,,,,,,,,,,,,,0,0,0,0,8,Ice,2,0,0,0,0,7,0,Exists,929,DSN-2806 Alpha I,3,Gas Giant,,,Medium,Massive,0,11,4,11,0,0,,,2,,,Sparse Sulfuric-Acid Clouds,Gas Giant,"Atmospheric Bands, Cloud Layers, Polar Vortices","Day/Night Rotation, Sunrises, Sunsets, Meteor Streaks, Aurorae, Wind, Jetstreams, Storms, Lightning, Cyclones, Cloud Pillars, Haze, Free-Floating Clouds, Sulfuric-Acid Rain, Diamond Rain, Hail, Snow",2,4,9,,,,3,3,-434,-44,Exists,930,DSN-2806 Beta I,3,Rocky Planet,3,,Large,Heavy,0,10,0,7,0,3,5,4,4,Deep Global Water-Ice Shell and Subsurface Ocean,,Abundant Water Clouds,Ice-Shell Planet,"Mountains, Plains, Subsurface Water Ocean, Water Cryovolcanoes","Day/Night Rotation, Sunrises, Sunsets, Meteor Streaks, Aurorae, Cryovolcanic Eruptions, Water-Ice Rain, Wind, Snow Devils, Blizzards, Lightning, Water Snow, Water Frost, Avalanches",2,5,4,Marginal Carbon-Water Life,in the Clouds,,14,2,231,81,Exists,931,DSN-2806 AB I,0,Rocky Planet,0,,Medium,Medium,0,0,,,,,0,0,0,-,,No Clouds,Dry Planet,"Mountains, Plains, Craters","Day/Night Rotation, Sunrises, Sunsets, Meteor Impacts",8,8,2,Marginal Carbon-Water Life,in the Clouds,,2,3,-929,-515,Exists,932,3,Ice Ring,DSN-2806 AB I a,,,,,,,,,,,,,,,Icy Ring,"Rocks, Boulders, Dust, Ice Chunks, Ice Dust, Gaps, Ringlets, Spiral Waves, Clusters, Clumps, Shepherd Moons, Gap Moonlets, Propeller Moonlets",,8,Usually Not Eclipsed,,,-959,-561,-,,,,,,,,,,,,,,,,,,,,,,,,,,,,,,-,,,,,,,,,,-,,,,,-,,,,
281,DSN-2813,418,167,,280,282,304,934,Dwarf,Red,M,1,10,-,DSN-2813 Alpha,Binary,-566,-276,935,Dwarf,Yellow,G,3,DSN-2813 Beta,566,276,Detached,,,,,,,,,,,,,,0,0,0,0,4,No Ice,1,0,0,0,0,5,0,Exists,936,DSN-2813 Alpha I,3,Rocky Planet,7,,Small,Light,0,3,3,0,0,2,3,2,0,-,,No Clouds,Dry Planet,"Mountains, Plains, Dunes, Volcanoes","Day/Night Rotation, Sunrises, Sunsets, Meteor Streaks, Aurorae, Ash Rain, Lava Flows, Volcanic Eruptions, Volcanic Lightning, Ash Devils, Ash Blizzards, Wind, Dust Devils, Dust Storms",2,0,3,,,,15,1,-712,-125,Exists,937,DSN-2813 Beta I,5,Large Asteroid,,Carbonaceous,Large,Micro,0,,,,,,,,,-,,,Asteroid,"Gravitational Rounding, Rocky Surface",Rotation,2,5,2,,,,11,2,668,355,Exists,938,DSN-2813 Beta II,4,Rocky Planet,9,,Small,Light,0,3,0,1,0,3,4,3,8,,Deep Polar Water Oceans,Global Water Cloud Cover,Shrouded Planet,"Mountains, Plains, Dunes, Volcanoes, Water Lakes, Water Rivers, Canyons, Water Oceans","Day/Night Rotation, Ash Rain, Lava Flows, Volcanic Eruptions, Volcanic Lightning, Ash Devils, Ash Blizzards, Wind, Dust Devils, Dust Storms, Lightning, Water Rain, Fog, Tornadoes, Storms, Landslides, Sinkholes, Water Dew, Hurricanes, Tsunamis, Sea Storms, Water-Spouts",3,8,2,Superabundant Silicon-Water Life,,4,16,1,286,451,-,,,,,,,,,,,,,,,,,,,,,,,,,,,,-,,,,,,,,,,,,,,,,,,,,,,,,,,,,,,-,,,,,,,,,,-,,,,,-,,,,
282,DSN-2823,484,251,259,281,283,305,939,Dwarf,Brown,Br.,0,0,-,DSN-2823 Alpha,Binary,284,-126,940,Dwarf,Red,M,1,DSN-2823 Beta,-284,126,Detached,,,,,,,,,,,,,,0,0,0,0,5,Ice,1,0,0,0,0,3,0,-,,,,,,,,,,,,,,,,,,,,,,,,,,,,,,,,,,#NUM!,#NUM!,#NUM!,#NUM!,#NUM!,#NUM!,#NUM!,#NUM!,#NUM!,#NUM!,#NUM!,#NUM!,#NUM!,#NUM!,#NUM!,#NUM!,#NUM!,#NUM!,#NUM!,#NUM!,#NUM!,#NUM!,#NUM!,#NUM!,#NUM!,#NUM!,#NUM!,#NUM!,#NUM!,#NUM!,#NUM!,#NUM!,#NUM!,#NUM!,Exists,#NUM!,#NUM!,3,Rocky Planet,6,,Large,Heavy,0,5,0,2,0,3,4,3,4,,Partial Polar Methane Oceans,Abundant Methane Clouds,Mixed Planet,"Mountains, Plains, Dunes, Volcanoes, Methane Lakes, Methane Rivers, Canyons, Methane Oceans","Day/Night Rotation, Sunrises, Sunsets, Meteor Streaks, Aurorae, Ash Rain, Lava Flows, Volcanic Eruptions, Volcanic Lightning, Ash Devils, Ash Blizzards, Wind, Dust Devils, Dust Storms, Lightning, Methane Rain, Fog, Tornadoes, Storms, Landslides, Sinkholes, Methane Dew",2,6,10,Superabundant Carbon-Methane Life,Primarily on the Land,1,6,3,-217,-68,#NUM!,#NUM!,#NUM!,#NUM!,#NUM!,#NUM!,#NUM!,#NUM!,#NUM!,#NUM!,#NUM!,#NUM!,#NUM!,#NUM!,#NUM!,#NUM!,#NUM!,#NUM!,#NUM!,#NUM!,#NUM!,#NUM!,#NUM!,#NUM!,,,#NUM!,#NUM!,#NUM!,#NUM!,#NUM!,#NUM!,#NUM!,#NUM!,#NUM!,#NUM!,#NUM!,#NUM!,#NUM!,#NUM!,#NUM!,#NUM!,#NUM!,#NUM!,#NUM!,#NUM!,#NUM!,#NUM!,#NUM!,#NUM!,#NUM!,#NUM!,#NUM!,,,#NUM!,#NUM!,#NUM!,#NUM!,#NUM!,#NUM!,#NUM!,#NUM!,#NUM!,#NUM!,#NUM!,#NUM!,#NUM!,-,,,,,#NUM!,#NUM!,#NUM!,#NUM!,#NUM!
283,DSN-2831,546,344,260,282,284,306,#NUM!,Giant,Blue-Violet,O,9,5,-,DSN-2831 Alpha,Binary,116,148,#NUM!,Dwarf,Orange,K,2,DSN-2831 Beta,-231,-296,Detached,,,,,,,,,,,,,,0,0,0,0,1,No Ice,0,0,0,0,0,4,0,Exists,#NUM!,DSN-2831 Alpha I,10,Rocky Planet,10,,Large,Heavy,1,6,0,0,1,6,11,8,3,Deep Dayside Lava Ocean,Deep Nightside Volcanic Crust,Abundant Ash Clouds,Eyeball Planet,"Lava Ocean, Nightside Crust Cap","Synchronized Rotation, Meteor Streaks, Aurorae, Ash Rain, Volcanic Lightning, Ash Devils, Wind Storms, Ash Blizzards, Lava Tsunamis, Crust Calving",1,-1,0,,,,1,3,4,136,-,,,,,,,,,,,,,,,,,,,,,,,,,,,,,,,,,,Exists,#NUM!,DSN-2831 AB I,7,Rocky Planet,10,,Medium,Medium,0,6,6,0,0,6,7,6,10,-,,Global Methane Cloud Cover,Shrouded Planet,"Mountains, Plains, Dunes, Volcanoes","Day/Night Rotation, Ash Rain, Lava Flows, Volcanic Eruptions, Volcanic Lightning, Ash Devils, Ash Blizzards, Wind, Dust Devils, Dust Storms, Lightning, Atmospheric Methane Rain, Tornadoes, Storms",6,0,3,Marginal Silicon-Methane Life,in the Clouds,,4,3,-462,-711,-,,,,,,,,,,,,,,,,,,,,,,,,,,,,-,,,,,,,,,,,,,,,,,,,,,,,,,,,,,,-,,,,,,,,,,-,,,,,-,,,,
284,DSN-2848,579,384,261,283,,307,#NUM!,Dwarf,Yellow-White,F,4,5,-,DSN-2848 Alpha,Binary,182,241,#NUM!,Dwarf,Brown,Br.,0,DSN-2848 Beta,-182,-241,Detached,,,,,,,,,,,,,,0,0,0,0,0,No Ice,0,0,0,0,0,2,0,-,,,,,,,,,,,,,,,,,,,,,,,,,,,,,,,,,,-,,,,,,,,,,,,,,,,,,,,,,,,,,,,,,,,,,-,,,,,,,,,,,,,,,,,,,,,,,,,,,,,,,,,,-,,,,,,,,,,,,,,,,,,,,,,,,,,,,-,,,,,,,,,,,,,,,,,,,,,,,,,,,,,,-,,,,,,,,,,Exists,180,#NUM!,18,254,Exists,135,#NUM!,-352,609
285,DSN-2859,636,519,262,,286,308,#NUM!,Dwarf,Red,M,1,10,-,DSN-2859,Single,0,0,,,,,,,,,,,,,,,,,,,,,,,0,0,0,0,9,Ice,2,0,0,0,0,3,0,Exists,#NUM!,DSN-2859 I,3,Large Asteroid,,Carbonaceous,Medium,Micro,0,,,,,,,,,-,,,Asteroid,Rocky Surface,Rotation,3,2,3,,,,10,1,204,82,-,,,,,,,,,,,,,,,,,,,,,,,,,,,,,,,,,,Exists,#NUM!,DSN-2859 II,0,Large Asteroid,,Icy Carb.,Large,Micro,0,,,,,,,,,Surface Ice and Subsurface Ocean,,,Icy Asteroid,"Gravitational Rounding, Rocky Surface, Ice",Rotation,8,6,0,,,,3,3,-630,-588,-,,,,,,,,,,,,,,,,,,,,,,,,,,,,-,,,,,,,,,,,,,,,,,,,,,,,,,,,,,,-,,,,,,,,,,-,,,,,-,,,,
286,DSN-2868,724,573,263,285,287,309,#NUM!,Giant,Blue-Violet,O,9,5,-,DSN-2868,Single,0,0,,,,,,,,,,,,,,,,,,,,,,,0,0,0,0,1,No Ice,0,0,0,0,0,2,0,-,,,,,,,,,,,,,,,,,,,,,,,,,,,,,,,,,,-,,,,,,,,,,,,,,,,,,,,,,,,,,,,,,,,,,Exists,#NUM!,DSN-2868 I,6,Rocky Planet,6,,Small,Light,0,1,1,0,0,1,6,5,0,-,,No Clouds,Dry Planet,"Mountains, Plains, Dunes, Volcanoes","Day/Night Rotation, Sunrises, Sunsets, Meteor Impacts, Meteor Streaks, Aurorae, Ash Rain, Lava Flows, Volcanic Eruptions, Volcanic Lightning, Ash Devils, Ash Blizzards, Wind, Dust Devils, Dust Storms",7,10,0,,,,3,1,-602,-669,-,,,,,,,,,,,,,,,,,,,,,,,,,,,,-,,,,,,,,,,,,,,,,,,,,,,,,,,,,,,-,,,,,,,,,,Exists,45,#NUM!,414,530,Exists,180,#NUM!,-140,2
